URL,Title,Description,H1,Canonical,Total_Links,Links_In,Issues
https://dolarexpress.cl/terminos/,Términos y Condiciones | DolarExpress,Términos y condiciones del servicio de DolarExpres,Términos y Condiciones,https://dolarexpress.cl/terminos.html,4,0,Canonical mismatch; Orphaned
https://dolarexpress.cl/transferir-cupo-cmr-a-cuenta/,Transferir Cupo CMR a Cuenta Bancaria: Cómo Funcio,Transfiere cupo CMR a tu cuenta bancaria. Mecanism,Transferir Cupo Cmr A Cuenta,https://dolarexpress.cl/sacar-plata-cmr/,20,0,Canonical mismatch; Orphaned
https://dolarexpress.cl/vender-cupo-banco-chile/,Vender Cupo Banco de Chile|DolarExpress,Vende tu cupo en dolares de tarjeta Banco de Chile,DolarExpress,https://dolarexpress.cl/vender-cupo-banco-chile.html,9,0,Canonical mismatch; Orphaned
https://dolarexpress.cl/vender-cupo-banco-estado/,Vender Cupo Dólar Banco Estado Chile | DolarExpres,¿Tienes cupo en dólares en Banco Estado? Lo conver,Vende tu cupo en dólares de Banco Estado y recibe ,https://dolarexpress.cl/vender-cupo-banco-estado.html,17,0,Canonical mismatch; Orphaned
https://dolarexpress.cl/vender-cupo-bci/,Vender Cupo Dólar BCI Chile | DolarExpress,Convierte el cupo en dólares de tu tarjeta BCI a p,Vende tu cupo en dólares BCI y obtén pesos chileno,https://dolarexpress.cl/vender-cupo-bci.html,17,0,Canonical mismatch; Orphaned
https://dolarexpress.cl/vender-cupo-cmr-falabella/,CMR Falabella Credit Line Landing Page,,DolarExpress - CMR Falabella,https://dolarexpress.cl/vender-cupo-cmr-falabella.html,8,0,No description; Canonical mismatch; Orphaned
https://dolarexpress.cl/vender-cupo-dolar-online/,Vender Cupo Dólar Online Chile | DolarExpress,Proceso 100% online para convertir tu cupo en dóla,Vende tu cupo en dólares 100% online,https://dolarexpress.cl/vender-cupo-dolar-online.html,17,0,Canonical mismatch; Orphaned
https://dolarexpress.cl/vender-cupo-dolar-tarjeta-credito/,Vender Cupo Dólar con Tarjeta de Crédito | DolarEx,Convierte el cupo en dólares de tu tarjeta de créd,Vende tu cupo dólar de tarjeta de crédito y recibe,https://dolarexpress.cl/vender-cupo-dolar-tarjeta-credito.html,17,0,Canonical mismatch; Orphaned
https://dolarexpress.cl/vender-cupo-dolar-transferencia/,Vender Cupo Dólar por Transferencia Chile | DolarE,Vende tu cupo en dólares y recibe pesos chilenos d,Recibe pesos por transferencia al vender tu cupo d,https://dolarexpress.cl/vender-cupo-dolar-transferencia.html,17,0,Canonical mismatch; Orphaned
https://dolarexpress.cl/vender-cupo-dolar/,Vender Cupo Dólar en Chile | DolarExpress,Vende tu cupo en dólares de tarjeta de crédito y r,Vende tu cupo en dólares y recibe pesos chilenos h,https://dolarexpress.cl/vender-cupo-dolar.html,17,0,Canonical mismatch; Orphaned
https://dolarexpress.cl/vender-cupo-internacional/,Vender Cupo Tarjeta Internacional | DolarExpress C,,Vender Cupo en Dólares de Tarjeta Internacional,https://dolarexpress.cl/vender-cupo-internacional.html,8,0,No description; Canonical mismatch; Orphaned
https://dolarexpress.cl/vender-cupo-itau/,Vender Cupo Dólar Itaú Chile | DolarExpress,¿Tienes cupo en dólares en Itaú Chile? Conviértelo,Vende tu cupo en dólares Itaú y recibe pesos al in,https://dolarexpress.cl/vender-cupo-itau.html,17,0,Canonical mismatch; Orphaned
https://dolarexpress.cl/vender-cupo-santander/,Vender Cupo Dólar Santander Chile | DolarExpress,Vende el cupo en dólares de tu tarjeta Santander y,Convierte tu cupo en dólares Santander a pesos chi,https://dolarexpress.cl/vender-cupo-santander.html,17,0,Canonical mismatch; Orphaned
https://dolarexpress.cl/vender-cupo-scotiabank/,Vender Cupo Dólar Scotiabank Chile | DolarExpress,¿Tienes cupo en dólares en Scotiabank? Te lo conve,Vende tu cupo en dólares de Scotiabank y recibe pe,https://dolarexpress.cl/vender-cupo-scotiabank.html,17,0,Canonical mismatch; Orphaned
https://dolarexpress.cl/vender-dolares-tarjeta-credito/,Vender Dólares de Tarjeta de Crédito Chile | Dolar,Usa el cupo en dólares de tu tarjeta de crédito y ,Vende los dólares de tu tarjeta de crédito,https://dolarexpress.cl/vender-dolares-tarjeta-credito.html,17,0,Canonical mismatch; Orphaned
https://dolarexpress.cl/vender-usd-chile/,Vender USD en Chile | DolarExpress,Vende tus dólares o cupo en USD en Chile y recibe ,Vende tus USD en Chile y recibe pesos,https://dolarexpress.cl/vender-usd-chile.html,17,0,Canonical mismatch; Orphaned
https://dolarexpress.cl/vender-usd/,Vender USD en Chile | DolarExpress,Vende tus dólares (USD) y recibe pesos chilenos po,Vende tu cupo en dólares (USD) y recibe pesos chil,https://dolarexpress.cl/vender-usd.html,11,0,Canonical mismatch; Orphaned
https://dolarexpress.cl/venta-cupo-dolares/,Venta de Cupo en Dólares Chile | DolarExpress,Realiza la venta de tu cupo en dólares con DolarEx,Servicio profesional de venta de cupo en dólares e,https://dolarexpress.cl/venta-cupo-dolares.html,17,0,Canonical mismatch; Orphaned
https://dolarexpress.cl/widget/,Widget de Cambio | Dolar Express,,Cambia tus USDpor pesos CLP,https://dolarexpress.cl/widget.html,4,0,No description; Canonical mismatch; Orphaned
