URL,Title,Description,H1,Canonical,Total_Links,Links_In,Issues
https://dolarexpress.cl/./index/,Vender Cupo en Dólares a Pesos | Transferencia Inm,¿Necesitas liquidez? Compramos tu cupo en dólares ,,https://dolarexpress.cl/,0,0,No h1; Canonical mismatch; Orphaned
https://dolarexpress.cl/./ripley-plata-al-tiro/,Efectivo con Ripley en 20 minutos: Proceso y Costo,Efectivo en 20 minutos con Ripley. Comisión 15%. C,Ripley Plata Al Tiro,https://dolarexpress.cl/ripley-plata-al-tiro/,18,0,Canonical mismatch; Orphaned
https://dolarexpress.cl/./sacar-dinero-tarjeta-abc-din/,"Sacar Dinero Tarjeta Abc Din: Proceso, Costos y Ri","Sacar Dinero Tarjeta Abc Din: comisión 15%, proces",Sacar Dinero Tarjeta Abc Din,https://dolarexpress.cl/sacar-dinero-tarjeta-abc-din/,18,0,Canonical mismatch; Orphaned
https://dolarexpress.cl/./sacar-dinero-tarjeta-casa-comercial/,"Sacar Dinero Tarjeta Casa Comercial: Proceso, Cost","Sacar Dinero Tarjeta Casa Comercial: comisión 15%,",Sacar Dinero Tarjeta Casa Comercial,https://dolarexpress.cl/sacar-dinero-tarjeta-casa-comercial/,18,0,Canonical mismatch; Orphaned
https://dolarexpress.cl/./sacar-dinero-tarjeta-cmr-falabella/,"Sacar Dinero Tarjeta Cmr Falabella: Proceso, Costo","Sacar Dinero Tarjeta Cmr Falabella: comisión 15%, ",Sacar Dinero Tarjeta Cmr Falabella,https://dolarexpress.cl/sacar-dinero-tarjeta-cmr-falabella/,18,0,Canonical mismatch; Orphaned
https://dolarexpress.cl/./sacar-dinero-tarjeta-hites/,"Sacar Dinero Tarjeta Hites: Proceso, Costos y Ries","Sacar Dinero Tarjeta Hites: comisión 15%, proceso ",Sacar Dinero Tarjeta Hites,https://dolarexpress.cl/sacar-dinero-tarjeta-hites/,18,0,Canonical mismatch; Orphaned
https://dolarexpress.cl/./sacar-dinero-tarjeta-jumbo/,"Sacar Dinero Tarjeta Jumbo: Proceso, Costos y Ries","Sacar Dinero Tarjeta Jumbo: comisión 15%, proceso ",Sacar Dinero Tarjeta Jumbo,https://dolarexpress.cl/sacar-dinero-tarjeta-jumbo/,18,0,Canonical mismatch; Orphaned
https://dolarexpress.cl/./sacar-dinero-tarjeta-la-polar/,"Sacar Dinero Tarjeta La Polar: Proceso, Costos y R","Sacar Dinero Tarjeta La Polar: comisión 15%, proce",Sacar Dinero Tarjeta La Polar,https://dolarexpress.cl/sacar-dinero-tarjeta-la-polar/,18,0,Canonical mismatch; Orphaned
https://dolarexpress.cl/./sacar-dinero-tarjeta-lider/,"Sacar Dinero Tarjeta Lider: Proceso, Costos y Ries","Sacar Dinero Tarjeta Lider: comisión 15%, proceso ",Sacar Dinero Tarjeta Lider,https://dolarexpress.cl/sacar-dinero-tarjeta-lider/,18,0,Canonical mismatch; Orphaned
https://dolarexpress.cl/./sacar-dinero-tarjeta-paris/,"Sacar Dinero Tarjeta Paris: Proceso, Costos y Ries","Sacar Dinero Tarjeta Paris: comisión 15%, proceso ",Sacar Dinero Tarjeta Paris,https://dolarexpress.cl/sacar-dinero-tarjeta-paris/,18,0,Canonical mismatch; Orphaned
https://dolarexpress.cl/./sacar-dinero-tarjeta-ripley/,"Sacar Dinero Tarjeta Ripley: Proceso, Costos y Rie","Sacar Dinero Tarjeta Ripley: comisión 15%, proceso",Sacar Dinero Tarjeta Ripley,https://dolarexpress.cl/sacar-dinero-tarjeta-ripley/,18,0,Canonical mismatch; Orphaned
https://dolarexpress.cl/./sacar-plata-cmr/,"Sacar Plata Cmr: Proceso, Costos y Riesgos | Dolar","Sacar Plata Cmr: comisión 15%, proceso en 15 minut",Sacar Plata Cmr,https://dolarexpress.cl/sacar-plata-cmr/,18,0,Canonical mismatch; Orphaned
https://dolarexpress.cl/./sacar-plata-de-tarjeta-de-tienda/,"Sacar Plata De Tarjeta De Tienda: Proceso, Costos ","Sacar Plata De Tarjeta De Tienda: comisión 15%, pr",Sacar Plata De Tarjeta De Tienda,https://dolarexpress.cl/sacar-plata-de-tarjeta-de-tienda/,18,0,Canonical mismatch; Orphaned
https://dolarexpress.cl/./sacar-plata-ripley/,"Sacar Plata Ripley: Proceso, Costos y Riesgos | Do","Sacar Plata Ripley: comisión 15%, proceso en 20 mi",Sacar Plata Ripley,https://dolarexpress.cl/sacar-plata-ripley/,18,0,Canonical mismatch; Orphaned
https://dolarexpress.cl/./sacar-plata-tarjeta-abcdin/,"Sacar Plata Tarjeta Abcdin: Proceso, Costos y Ries","Sacar Plata Tarjeta Abcdin: comisión 15%, proceso ",Sacar Plata Tarjeta Abcdin,https://dolarexpress.cl/sacar-plata-tarjeta-abcdin/,18,0,Canonical mismatch; Orphaned
https://dolarexpress.cl/./sacar-plata-tarjeta-cencosud/,"Sacar Plata Tarjeta Cencosud: Proceso, Costos y Ri","Sacar Plata Tarjeta Cencosud: comisión 15%, proces",Sacar Plata Tarjeta Cencosud,https://dolarexpress.cl/sacar-plata-tarjeta-cencosud/,18,0,Canonical mismatch; Orphaned
https://dolarexpress.cl/./venta-usd/,Procesar Venta | DolarExpress,Procesa tu venta de cupo en dólares de forma segur,Procesa tu Venta,,7,0,No canonical; Orphaned
https://dolarexpress.cl/avance-abc-visa/,"Avance Abc Visa: Proceso, Costos y Riesgos | Dolar","Avance Abc Visa: comisión 15%, proceso en 20 minut",Avance Abc Visa,https://dolarexpress.cl/avance-abc-visa/,20,0,Orphaned
https://dolarexpress.cl/avance-cmr-sin-avance-habilitado/,CMR Sin Avance: Cómo Obtener Efectivo con Cupo de ,Obtén efectivo de tu CMR sin avance habilitado. Co,Avance Cmr Sin Avance Habilitado,https://dolarexpress.cl/tarjeta-cmr-sin-avance/,20,0,Canonical mismatch; Orphaned
https://dolarexpress.cl/avance-cupo-dolares/,Avance con Cupo en Dólares Chile | DolarExpress,Usa tu cupo en dólares para obtener un avance en p,Obtén un avance usando tu cupo en dólares,https://dolarexpress.cl/avance-cupo-dolares.html,17,0,Canonical mismatch; Orphaned
https://dolarexpress.cl/avance-efectivo-dolares/,Avance en Efectivo con Dólares Chile | DolarExpres,Convierte tus dólares o cupo en dólares en pesos c,Avance en efectivo usando tus dólares o cupo USD,https://dolarexpress.cl/avance-efectivo-dolares.html,17,0,Canonical mismatch; Orphaned
https://dolarexpress.cl/avance-efectivo-sin-avance-habilitado/,tu tarjeta de tienda Sin Avance: Cómo Obtener Efec,Obtén efectivo de tu tu tarjeta de tienda sin avan,Avance Efectivo Sin Avance Habilitado,https://dolarexpress.cl/tarjeta-ripley-sin-avance/,20,0,Canonical mismatch; Orphaned
https://dolarexpress.cl/avance-efectivo-tarjeta-abc/,"Avance Efectivo Tarjeta Abc: Proceso, Costos y Rie","Avance Efectivo Tarjeta Abc: comisión 15%, proceso",Avance Efectivo Tarjeta Abc,https://dolarexpress.cl/avance-abc-visa/,20,0,Canonical mismatch; Orphaned
https://dolarexpress.cl/avance-efectivo-tarjeta-cmr/,"Avance Efectivo Tarjeta Cmr: Proceso, Costos y Rie","Avance Efectivo Tarjeta Cmr: comisión 15%, proceso",Avance Efectivo Tarjeta Cmr,https://dolarexpress.cl/sacar-plata-cmr/,20,0,Canonical mismatch; Orphaned
https://dolarexpress.cl/avance-efectivo-tarjeta-hites/,"Avance Efectivo Tarjeta Hites: Proceso, Costos y R","Avance Efectivo Tarjeta Hites: comisión 15%, proce",Avance Efectivo Tarjeta Hites,https://dolarexpress.cl/hites-plata-rapido/,20,0,Canonical mismatch; Orphaned
https://dolarexpress.cl/avance-efectivo-tarjeta-la-polar/,"Avance Efectivo Tarjeta La Polar: Proceso, Costos ","Avance Efectivo Tarjeta La Polar: comisión 15%, pr",Avance Efectivo Tarjeta La Polar,https://dolarexpress.cl/avance-la-polar-cuotas/,20,0,Canonical mismatch; Orphaned
https://dolarexpress.cl/avance-efectivo-tarjeta-lider/,"Avance Efectivo Tarjeta Lider: Proceso, Costos y R","Avance Efectivo Tarjeta Lider: comisión 15%, proce",Avance Efectivo Tarjeta Lider,https://dolarexpress.cl/avance-lider-bci-online/,20,0,Canonical mismatch; Orphaned
https://dolarexpress.cl/avance-efectivo-tarjeta-paris/,"Avance Efectivo Tarjeta Paris: Proceso, Costos y R","Avance Efectivo Tarjeta Paris: comisión 15%, proce",Avance Efectivo Tarjeta Paris,https://dolarexpress.cl/avance-tarjeta-easy/,20,0,Canonical mismatch; Orphaned
https://dolarexpress.cl/avance-efectivo-tarjeta-ripley/,"Avance Efectivo Tarjeta Ripley: Proceso, Costos y ","Avance Efectivo Tarjeta Ripley: comisión 15%, proc",Avance Efectivo Tarjeta Ripley,https://dolarexpress.cl/sacar-plata-ripley/,20,0,Canonical mismatch; Orphaned
https://dolarexpress.cl/avance-efectivo-tarjetas-grandes-tiendas-chile/,Avance Efectivo Tarjetas Grandes Tiendas Chile: Pr,Avance Efectivo Tarjetas Grandes Tiendas Chile: co,Avance Efectivo Tarjetas Grandes Tiendas Chile,https://dolarexpress.cl/sacar-plata-ripley/,20,0,Canonical mismatch; Orphaned
https://dolarexpress.cl/avance-efectivo/,Avance en Efectivo con Cupo Dólar | DolarExpress,Obtén un avance en efectivo usando tu cupo en dóla,Avance en efectivo usando tu cupo en dólares,https://dolarexpress.cl/avance-efectivo.html,11,0,Canonical mismatch; Orphaned
https://dolarexpress.cl/avance-la-polar-cuotas/,Efectivo La Polar en Cuotas: Tabla de Costos Reale,Cuotas La Polar: tabla completa de costos. Tasa 1.,Avance La Polar Cuotas,https://dolarexpress.cl/avance-la-polar-cuotas/,20,0,Orphaned
https://dolarexpress.cl/avance-lider-bci-online/,Líder a Efectivo 100% Online: Proceso y Comisiones,Proceso online con Líder: WhatsApp + Transbank + t,Avance Lider Bci Online,https://dolarexpress.cl/avance-lider-bci-online/,20,0,Orphaned
https://dolarexpress.cl/avance-ripley-cuotas/,Efectivo Ripley en Cuotas: Tabla de Costos Reales ,Cuotas Ripley: tabla completa de costos. Tasa 1.55,Avance Ripley En Cuotas,https://dolarexpress.cl/sacar-plata-ripley/,20,0,Canonical mismatch; Orphaned
https://dolarexpress.cl/avance-ripley-sin-tener-avance/,Avance Ripley Sin Tener Avance Habilitado: Proceso,Avance Ripley Sin Tener Avance Habilitado: comisió,Avance Ripley Sin Tener Avance Habilitado,https://dolarexpress.cl/sacar-plata-ripley/,20,0,Canonical mismatch; Orphaned
https://dolarexpress.cl/avance-tarjeta-dolares/,Avance de Tarjeta en Dólares Chile | DolarExpress,Obtén un avance usando el cupo en dólares de tu ta,Avance de tarjeta en dólares a pesos chilenos,https://dolarexpress.cl/avance-tarjeta-dolares.html,17,0,Canonical mismatch; Orphaned
https://dolarexpress.cl/avance-tarjeta-easy/,"Avance Efectivo Tarjeta Easy: Proceso, Costos y Ri","Avance Efectivo Tarjeta Easy: comisión 15%, proces",Avance Efectivo Tarjeta Easy,https://dolarexpress.cl/avance-tarjeta-easy/,20,0,Orphaned
https://dolarexpress.cl/avance-tarjeta-johnson/,"Avance Efectivo Tarjeta Johnson: Proceso, Costos y","Avance Efectivo Tarjeta Johnson: comisión 15%, pro",Avance Efectivo Tarjeta Johnson,https://dolarexpress.cl/avance-tarjeta-easy/,20,0,Canonical mismatch; Orphaned
https://dolarexpress.cl/cambiar-cupo-dolar/,Cambiar Cupo Dólar a Pesos Chilenos | DolarExpress,Cambia el cupo en dólares de tu tarjeta a pesos ch,Cambia tu cupo en dólares a pesos chilenos hoy mis,https://dolarexpress.cl/cambiar-cupo-dolar.html,17,0,Canonical mismatch; Orphaned
https://dolarexpress.cl/cambiar-cupo-dolares-chile/,Cambiar Cupo en Dólares en Chile | DolarExpress,Servicio de cambio de cupo en dólares a pesos chil,Cambia tu cupo en dólares en Chile sin complicacio,https://dolarexpress.cl/cambiar-cupo-dolares-chile.html,17,0,Canonical mismatch; Orphaned
https://dolarexpress.cl/cambiar-dolares-tarjeta/,Cambiar Dólares de Tarjeta a Pesos Chilenos | Dola,Convierte los dólares disponibles en tu tarjeta de,Cambia los dólares de tu tarjeta a pesos chilenos ,https://dolarexpress.cl/cambiar-dolares-tarjeta.html,17,0,Canonical mismatch; Orphaned
https://dolarexpress.cl/cambio-cupo-dolar/,Cambio de Cupo Dólar en Chile | DolarExpress,Realiza el cambio de tu cupo en dólares a pesos ch,Servicio de cambio de cupo en dólares en Chile,https://dolarexpress.cl/cambio-cupo-dolar.html,17,0,Canonical mismatch; Orphaned
https://dolarexpress.cl/cambio-dolares-tarjeta-credito/,Cambio Dólares Tarjeta de Crédito Chile | DolarExp,Realiza el cambio de dólares desde tu tarjeta de c,Servicio de cambio de dólares desde tarjeta de cré,https://dolarexpress.cl/cambio-dolares-tarjeta-credito.html,17,0,Canonical mismatch; Orphaned
https://dolarexpress.cl/cmr-efectivo-rapido/,Efectivo con CMR en 15 minutos: Proceso y Costos |,Efectivo en 15 minutos con CMR. Comisión 15%. Cron,Cmr Efectivo RáPido,https://dolarexpress.cl/sacar-plata-cmr/,20,0,Canonical mismatch; Orphaned
https://dolarexpress.cl/como-obtener-liquidez-con-tarjeta-retail/,Efectivo desde Tarjeta de Tienda: Costos y Riesgos,Tarjeta de tienda a efectivo: costos reales (15% c,Como Obtener Liquidez Con Tarjeta Retail,https://dolarexpress.cl/sacar-plata-ripley/,20,0,Canonical mismatch; Orphaned
https://dolarexpress.cl/como-sacar-plata-si-no-tengo-avance/,tu tarjeta de tienda Sin Avance: Cómo Obtener Efec,Obtén efectivo de tu tu tarjeta de tienda sin avan,Como Sacar Plata Si No Tengo Avance,https://dolarexpress.cl/tarjeta-ripley-sin-avance/,20,0,Canonical mismatch; Orphaned
https://dolarexpress.cl/como-usar-el-cupo-de-mi-tarjeta-sin-avance/,tu tarjeta de tienda Sin Avance: Cómo Obtener Efec,Obtén efectivo de tu tu tarjeta de tienda sin avan,Como Usar El Cupo De Mi Tarjeta Sin Avance,https://dolarexpress.cl/tarjeta-ripley-sin-avance/,20,0,Canonical mismatch; Orphaned
https://dolarexpress.cl/como-vender-cupo-dolar/,Cómo Vender Cupo en Dólares en Chile | DolarExpres,Guía completa para vender tu cupo en dólares en Ch,Cómo vender tu cupo en dólares paso a paso,https://dolarexpress.cl/como-vender-cupo-dolar.html,17,0,Canonical mismatch; Orphaned
https://dolarexpress.cl/compra-cupo-dolares/,Compra de Cupo en Dólares — DolarExpress | DolarEx,DolarExpress compra tu cupo en dólares y te paga e,Compramos tu cupo en dólares al mejor precio del m,https://dolarexpress.cl/compra-cupo-dolares.html,17,0,Canonical mismatch; Orphaned
https://dolarexpress.cl/comprar-cupo-dolar/,Comprar Cupo Dólar en Chile | DolarExpress,Si necesitas dólares usando el cupo de tu tarjeta ,¿Buscas comprar cupo en dólares? Nosotros te lo fa,https://dolarexpress.cl/comprar-cupo-dolar.html,17,0,Canonical mismatch; Orphaned
https://dolarexpress.cl/compro-cupo-dolar/,Compro Cupo Dólar — DolarExpress Chile | DolarExpr,¿Tienes cupo en dólares disponible? Te lo compramo,Compramos tu cupo en dólares y te pagamos al insta,https://dolarexpress.cl/compro-cupo-dolar.html,17,0,Canonical mismatch; Orphaned
https://dolarexpress.cl/contacto/,Contacto | DolarExpress,Contáctanos por WhatsApp para cotizar la conversió,Habla con DolarExpress,https://dolarexpress.cl/contacto.html,4,0,Canonical mismatch; Orphaned
https://dolarexpress.cl/convertir-cupo-dolar-pesos/,Convertir Cupo Dólar a Pesos Chilenos | DolarExpre,Convierte tu cupo en dólares a pesos chilenos de f,Convierte tu cupo en dólares a pesos chilenos hoy,https://dolarexpress.cl/convertir-cupo-dolar-pesos.html,17,0,Canonical mismatch; Orphaned
https://dolarexpress.cl/convertir-cupo-en-efectivo-chile/,Cupo de Compras tu tarjeta de tienda a Efectivo: C,Convierte cupo de compras tu tarjeta de tienda en ,Convertir Cupo En Efectivo Chile,https://dolarexpress.cl/cupo-compras-a-efectivo-ripley/,20,0,Canonical mismatch; Orphaned
https://dolarexpress.cl/convertir-cupo-internacional-pesos/,Convertir Cupo Internacional a Pesos | DolarExpres,Convierte tu convertir cupo internacional a pesos ,Convertir Cupo Internacional a Pesos,https://dolarexpress.cl/cupo-internacional-bci/,20,0,Canonical mismatch; Orphaned
https://dolarexpress.cl/cuanto-me-dan-de-avance-tarjeta-lider/,¿Cuánto Obtengo con Líder? Simulador y Tabla de Co,Simulador: cuánto recibes y cuánto pagas con Líder,Cuanto Me Dan De Avance Tarjeta Lider,https://dolarexpress.cl/cuanto-me-dan-de-avance-tarjeta-lider/,20,0,Orphaned
https://dolarexpress.cl/cuanto-presta-la-cmr/,¿Cuánto Obtengo con CMR? Simulador y Tabla de Cost,Simulador: cuánto recibes y cuánto pagas con CMR. ,Cuanto Presta La Cmr,https://dolarexpress.cl/cuanto-presta-la-cmr/,20,0,Orphaned
https://dolarexpress.cl/cuanto-presta-tarjeta-paris/,¿Cuánto Obtengo con Paris / Cencosud? Simulador y ,Simulador: cuánto recibes y cuánto pagas con Paris,Cuanto Presta Tarjeta Paris,https://dolarexpress.cl/cuanto-presta-tarjeta-paris/,20,0,Orphaned
https://dolarexpress.cl/cuanto-presta-tarjeta-ripley/,¿Cuánto Obtengo con Ripley? Simulador y Tabla de C,Simulador: cuánto recibes y cuánto pagas con Riple,Cuanto Presta Tarjeta Ripley,https://dolarexpress.cl/cuanto-presta-tarjeta-ripley/,20,0,Orphaned
https://dolarexpress.cl/cupo-compras-a-efectivo-cmr/,Cupo de Compras CMR a Efectivo: Costos Reales y Pr,Convierte cupo de compras CMR en efectivo. Comisió,Cupo Compras A Efectivo Cmr,https://dolarexpress.cl/cupo-compras-a-efectivo-cmr/,20,0,Orphaned
https://dolarexpress.cl/cupo-compras-a-efectivo-lider/,Cupo de Compras Líder a Efectivo: Costos Reales y ,Convierte cupo de compras Líder en efectivo. Comis,Cupo Compras A Efectivo Lider,https://dolarexpress.cl/cupo-compras-a-efectivo-lider/,20,0,Orphaned
https://dolarexpress.cl/cupo-compras-a-efectivo-ripley/,Cupo de Compras Ripley a Efectivo: Costos Reales y,Convierte cupo de compras Ripley en efectivo. Comi,Cupo Compras A Efectivo Ripley,https://dolarexpress.cl/cupo-compras-a-efectivo-ripley/,20,0,Orphaned
https://dolarexpress.cl/cupo-compras-efectivo-abcdin/,Cupo de Compras ABCDin a Efectivo: Costos Reales y,Convierte cupo de compras ABCDin en efectivo. Comi,Cupo Compras A Efectivo Abcdin,https://dolarexpress.cl/cupo-compras-efectivo-abcdin/,20,0,Orphaned
https://dolarexpress.cl/cupo-compras-efectivo-hites/,Cupo de Compras Hites a Efectivo: Costos Reales y ,Convierte cupo de compras Hites en efectivo. Comis,Cupo Compras A Efectivo Hites,https://dolarexpress.cl/cupo-compras-efectivo-hites/,20,0,Orphaned
https://dolarexpress.cl/cupo-compras-efectivo-la-polar/,Cupo de Compras La Polar a Efectivo: Costos Reales,Convierte cupo de compras La Polar en efectivo. Co,Cupo Compras A Efectivo La Polar,https://dolarexpress.cl/cupo-compras-efectivo-la-polar/,20,0,Orphaned
https://dolarexpress.cl/cupo-compras-efectivo-paris/,Cupo de Compras Paris / Cencosud a Efectivo: Costo,Convierte cupo de compras Paris / Cencosud en efec,Cupo Compras A Efectivo Paris,https://dolarexpress.cl/cupo-compras-efectivo-paris/,20,0,Orphaned
https://dolarexpress.cl/cupo-disponible-tarjeta-a-pesos/,Cupo de Compras tu tarjeta de tienda a Efectivo: C,Convierte cupo de compras tu tarjeta de tienda en ,Cupo Disponible Tarjeta A Pesos,https://dolarexpress.cl/cupo-compras-a-efectivo-ripley/,20,0,Canonical mismatch; Orphaned
https://dolarexpress.cl/cupo-dolar-1000-usd/,Vender Cupo Dólar 1000 USD en Chile | DolarExpress,Convierte USD 1.000 de cupo dólar a pesos chilenos,Vende USD 1.000 de cupo dólar y recibe pesos chile,https://dolarexpress.cl/cupo-dolar-1000-usd.html,17,0,Canonical mismatch; Orphaned
https://dolarexpress.cl/cupo-dolar-15-minutos/,Cupo Dólar en 15 Minutos Chile | DolarExpress,Conoce cuánto tarda realmente vender tu cupo dólar,¿Puedes vender tu cupo dólar en 15 minutos?,https://dolarexpress.cl/cupo-dolar-15-minutos.html,17,0,Canonical mismatch; Orphaned
https://dolarexpress.cl/cupo-dolar-200-usd/,Cupo Dólar 200 USD → Recibe ~$176.000 CLP | DolarE,¿Tienes USD 200 de cupo disponible? Recibe aproxim,Cambiar USD 200 de Cupo Dólar a Pesos,https://dolarexpress.cl/cupo-dolar-200-usd.html,20,0,Canonical mismatch; Orphaned
https://dolarexpress.cl/cupo-dolar-2000-usd/,Cupo Dólar 2.000 USD → Recibe ~$1.760.000 CLP | Do,¿Tienes USD 2.000 de cupo disponible? Recibe aprox,Cambiar USD 2.000 de Cupo Dólar a Pesos,https://dolarexpress.cl/cupo-dolar-200-usd/,20,0,Canonical mismatch; Orphaned
https://dolarexpress.cl/cupo-dolar-3000-usd/,Cupo Dólar 3.000 USD → Recibe ~$2.640.000 CLP | Do,¿Tienes USD 3.000 de cupo disponible? Recibe aprox,Cambiar USD 3.000 de Cupo Dólar a Pesos,https://dolarexpress.cl/cupo-dolar-200-usd/,20,0,Canonical mismatch; Orphaned
https://dolarexpress.cl/cupo-dolar-500-usd/,Vender Cupo Dólar 500 USD en Chile | DolarExpress,Convierte USD 500 de cupo dólar a pesos chilenos. ,Vende USD 500 de cupo dólar y recibe pesos al inst,https://dolarexpress.cl/cupo-dolar-500-usd.html,17,0,Canonical mismatch; Orphaned
https://dolarexpress.cl/cupo-dolar-5000-usd/,Cupo Dólar 5.000 USD → Recibe ~$4.400.000 CLP | Do,¿Tienes USD 5.000 de cupo disponible? Recibe aprox,Cambiar USD 5.000 de Cupo Dólar a Pesos,https://dolarexpress.cl/cupo-dolar-200-usd/,20,0,Canonical mismatch; Orphaned
https://dolarexpress.cl/cupo-dolar-7000-usd/,Cupo Dólar 7.000 USD → Recibe ~$6.160.000 CLP | Do,¿Tienes USD 7.000 de cupo disponible? Recibe aprox,Cambiar USD 7.000 de Cupo Dólar a Pesos,https://dolarexpress.cl/cupo-dolar-200-usd/,20,0,Canonical mismatch; Orphaned
https://dolarexpress.cl/cupo-dolar-a-pesos/,Cupo Dólar a Pesos Chilenos | DolarExpress,Transforma tu cupo dólar en pesos chilenos por tra,De cupo dólar a pesos chilenos en minutos,https://dolarexpress.cl/cupo-dolar-a-pesos.html,17,0,Canonical mismatch; Orphaned
https://dolarexpress.cl/cupo-dolar-altos-montos/,Cupo Dólar Altos Montos Chile | DolarExpress,¿Necesitas vender un alto monto en cupo dólar? Dol,Operaciones de cupo dólar en altos montos en Chile,https://dolarexpress.cl/cupo-dolar-altos-montos.html,17,0,Canonical mismatch; Orphaned
https://dolarexpress.cl/cupo-dolar-american-express/,Cupo Dólar Tarjeta American Express Chile | DolarE,¿Tienes cupo en dólares en tu Amex? Lo convertimos,Vende tu cupo en dólares de American Express en Ch,https://dolarexpress.cl/cupo-dolar-american-express.html,17,0,Canonical mismatch; Orphaned
https://dolarexpress.cl/cupo-dolar-amex/,Cupo Dólar American Express → Pesos Chilenos | Dol,Convierte el cupo en dólares de tu American Expres,Cupo Dólar American Express a Pesos Chilenos,https://dolarexpress.cl/cupo-dolar-amex.html,20,0,Canonical mismatch; Orphaned
https://dolarexpress.cl/cupo-dolar-antofagasta/,Cupo Dólar en Antofagasta — DolarExpress | DolarEx,Servicio de cambio de cupo en dólares en Antofagas,Vende tu cupo en dólares en Antofagasta y recibe p,https://dolarexpress.cl/cupo-dolar-arica/,17,0,Canonical mismatch; Orphaned
https://dolarexpress.cl/cupo-dolar-arica/,Cupo Dólar en Arica — DolarExpress | DolarExpress,Servicio de cambio de cupo en dólares en Arica. At,Vende tu cupo en dólares en Arica y recibe pesos h,https://dolarexpress.cl/cupo-dolar-arica.html,17,0,Canonical mismatch; Orphaned
https://dolarexpress.cl/cupo-dolar-banco-chile-amex/,Cupo Dólar Banco de Chile American Express | Dolar,Convierte el cupo de tu American Express de Banco ,Cupo Dólar Banco de Chile American Express a Pesos,https://dolarexpress.cl/cupo-dolar-bci-amex/,20,0,Canonical mismatch; Orphaned
https://dolarexpress.cl/cupo-dolar-banco-chile-antofagasta/,Cupo Dólar Banco de Chile Antofagasta | DolarExpre,Convierte tu cupo en dólares de Banco de Chile en ,Cupo Dólar Banco de Chile en Antofagasta,https://dolarexpress.cl/cupo-dolar-bci-temuco/,20,0,Canonical mismatch; Orphaned
https://dolarexpress.cl/cupo-dolar-banco-chile-concepcion/,Cupo Dólar Banco de Chile Concepción | DolarExpres,Convierte tu cupo en dólares de Banco de Chile en ,Cupo Dólar Banco de Chile en Concepción,https://dolarexpress.cl/cupo-dolar-bci-temuco/,20,0,Canonical mismatch; Orphaned
https://dolarexpress.cl/cupo-dolar-banco-chile-iquique/,Cupo Dólar Banco de Chile Iquique | DolarExpress,Convierte tu cupo en dólares de Banco de Chile en ,Cupo Dólar Banco de Chile en Iquique,https://dolarexpress.cl/cupo-dolar-bci-temuco/,20,0,Canonical mismatch; Orphaned
https://dolarexpress.cl/cupo-dolar-banco-chile-la-serena/,Cupo Dólar Banco de Chile La Serena | DolarExpress,Convierte tu cupo en dólares de Banco de Chile en ,Cupo Dólar Banco de Chile en La Serena,https://dolarexpress.cl/cupo-dolar-bci-temuco/,20,0,Canonical mismatch; Orphaned
https://dolarexpress.cl/cupo-dolar-banco-chile-mastercard-black/,Cupo Dólar Banco de Chile Mastercard Black | Dolar,Convierte el cupo de tu Mastercard Black de Banco ,Cupo Dólar Banco de Chile Mastercard Black a Pesos,https://dolarexpress.cl/cupo-dolar-bci-amex/,20,0,Canonical mismatch; Orphaned
https://dolarexpress.cl/cupo-dolar-banco-chile-mastercard-gold/,Cupo Dólar Banco de Chile Mastercard Gold | DolarE,Convierte el cupo de tu Mastercard Gold de Banco d,Cupo Dólar Banco de Chile Mastercard Gold a Pesos,https://dolarexpress.cl/cupo-dolar-bci-amex/,20,0,Canonical mismatch; Orphaned
https://dolarexpress.cl/cupo-dolar-banco-chile-mastercard-platinum/,Cupo Dólar Banco de Chile Mastercard Platinum | Do,Convierte el cupo de tu Mastercard Platinum de Ban,Cupo Dólar Banco de Chile Mastercard Platinum a Pe,https://dolarexpress.cl/cupo-dolar-bci-amex/,20,0,Canonical mismatch; Orphaned
https://dolarexpress.cl/cupo-dolar-banco-chile-puerto-montt/,Cupo Dólar Banco de Chile Puerto Montt | DolarExpr,Convierte tu cupo en dólares de Banco de Chile en ,Cupo Dólar Banco de Chile en Puerto Montt,https://dolarexpress.cl/cupo-dolar-bci-temuco/,20,0,Canonical mismatch; Orphaned
https://dolarexpress.cl/cupo-dolar-banco-chile-rancagua/,Cupo Dólar Banco de Chile Rancagua | DolarExpress,Convierte tu cupo en dólares de Banco de Chile en ,Cupo Dólar Banco de Chile en Rancagua,https://dolarexpress.cl/cupo-dolar-bci-temuco/,20,0,Canonical mismatch; Orphaned
https://dolarexpress.cl/cupo-dolar-banco-chile-santiago/,Cupo Dólar Banco de Chile Santiago | DolarExpress,Convierte tu cupo en dólares de Banco de Chile en ,Cupo Dólar Banco de Chile en Santiago,https://dolarexpress.cl/cupo-dolar-bci-temuco/,20,0,Canonical mismatch; Orphaned
https://dolarexpress.cl/cupo-dolar-banco-chile-temuco/,Cupo Dólar Banco de Chile Temuco | DolarExpress,Convierte tu cupo en dólares de Banco de Chile en ,Cupo Dólar Banco de Chile en Temuco,https://dolarexpress.cl/cupo-dolar-bci-temuco/,20,0,Canonical mismatch; Orphaned
https://dolarexpress.cl/cupo-dolar-banco-chile-valparaiso/,Cupo Dólar Banco de Chile Valparaíso | DolarExpres,Convierte tu cupo en dólares de Banco de Chile en ,Cupo Dólar Banco de Chile en Valparaíso,https://dolarexpress.cl/cupo-dolar-bci-temuco/,20,0,Canonical mismatch; Orphaned
https://dolarexpress.cl/cupo-dolar-banco-chile-vina-del-mar/,Cupo Dólar Banco de Chile Viña del Mar | DolarExpr,Convierte tu cupo en dólares de Banco de Chile en ,Cupo Dólar Banco de Chile en Viña del Mar,https://dolarexpress.cl/cupo-dolar-bci-temuco/,20,0,Canonical mismatch; Orphaned
