URL,Title,Description,H1,Canonical,Total_Links,Links_In,Issues
https://dolarexpress.cl/cupo-dolar-banco-chile-visa-gold/,Cupo Dólar Banco de Chile Visa Gold | DolarExpress,Convierte el cupo de tu Visa Gold de Banco de Chil,Cupo Dólar Banco de Chile Visa Gold a Pesos,https://dolarexpress.cl/cupo-dolar-bci-amex/,20,0,Canonical mismatch; Orphaned
https://dolarexpress.cl/cupo-dolar-banco-chile-visa-platinum/,Cupo Dólar Banco de Chile Visa Platinum | DolarExp,Convierte el cupo de tu Visa Platinum de Banco de ,Cupo Dólar Banco de Chile Visa Platinum a Pesos,https://dolarexpress.cl/cupo-dolar-bci-amex/,20,0,Canonical mismatch; Orphaned
https://dolarexpress.cl/cupo-dolar-banco-chile-visa-signature/,Cupo Dólar Banco de Chile Visa Signature | DolarEx,Convierte el cupo de tu Visa Signature de Banco de,Cupo Dólar Banco de Chile Visa Signature a Pesos,https://dolarexpress.cl/cupo-dolar-bci-amex/,20,0,Canonical mismatch; Orphaned
https://dolarexpress.cl/cupo-dolar-banco-chile/,Cupo Dólar Banco de Chile | DolarExpress,¿Tienes cupo en dólares en el Banco de Chile? Conv,Vende tu cupo dólar del Banco de Chile,https://dolarexpress.cl/cupo-dolar-bci/,17,0,Canonical mismatch; Orphaned
https://dolarexpress.cl/cupo-dolar-banco-estado/,Cupo Dólar Banco Estado Chile | DolarExpress,Convierte tu cupo en dólares del Banco Estado a pe,Vende tu cupo dólar Banco Estado,https://dolarexpress.cl/cupo-dolar-banco-estado.html,17,0,Canonical mismatch; Orphaned
https://dolarexpress.cl/cupo-dolar-bancoestado-amex/,Cupo Dólar BancoEstado American Express | DolarExp,Convierte el cupo de tu American Express de BancoE,Cupo Dólar BancoEstado American Express a Pesos,https://dolarexpress.cl/cupo-dolar-bci-amex/,20,0,Canonical mismatch; Orphaned
https://dolarexpress.cl/cupo-dolar-bancoestado-antofagasta/,Cupo Dólar BancoEstado Antofagasta | DolarExpress,Convierte tu cupo en dólares de BancoEstado en Ant,Cupo Dólar BancoEstado en Antofagasta,https://dolarexpress.cl/cupo-dolar-bci-temuco/,20,0,Canonical mismatch; Orphaned
https://dolarexpress.cl/cupo-dolar-bancoestado-concepcion/,Cupo Dólar BancoEstado Concepción | DolarExpress,Convierte tu cupo en dólares de BancoEstado en Con,Cupo Dólar BancoEstado en Concepción,https://dolarexpress.cl/cupo-dolar-bci-temuco/,20,0,Canonical mismatch; Orphaned
https://dolarexpress.cl/cupo-dolar-bancoestado-iquique/,Cupo Dólar BancoEstado Iquique | DolarExpress,Convierte tu cupo en dólares de BancoEstado en Iqu,Cupo Dólar BancoEstado en Iquique,https://dolarexpress.cl/cupo-dolar-bci-temuco/,20,0,Canonical mismatch; Orphaned
https://dolarexpress.cl/cupo-dolar-bancoestado-la-serena/,Cupo Dólar BancoEstado La Serena | DolarExpress,Convierte tu cupo en dólares de BancoEstado en La ,Cupo Dólar BancoEstado en La Serena,https://dolarexpress.cl/cupo-dolar-bci-temuco/,20,0,Canonical mismatch; Orphaned
https://dolarexpress.cl/cupo-dolar-bancoestado-mastercard-black/,Cupo Dólar BancoEstado Mastercard Black | DolarExp,Convierte el cupo de tu Mastercard Black de BancoE,Cupo Dólar BancoEstado Mastercard Black a Pesos,https://dolarexpress.cl/cupo-dolar-bci-amex/,20,0,Canonical mismatch; Orphaned
https://dolarexpress.cl/cupo-dolar-bancoestado-mastercard-gold/,Cupo Dólar BancoEstado Mastercard Gold | DolarExpr,Convierte el cupo de tu Mastercard Gold de BancoEs,Cupo Dólar BancoEstado Mastercard Gold a Pesos,https://dolarexpress.cl/cupo-dolar-bci-amex/,20,0,Canonical mismatch; Orphaned
https://dolarexpress.cl/cupo-dolar-bancoestado-mastercard-platinum/,Cupo Dólar BancoEstado Mastercard Platinum | Dolar,Convierte el cupo de tu Mastercard Platinum de Ban,Cupo Dólar BancoEstado Mastercard Platinum a Pesos,https://dolarexpress.cl/cupo-dolar-bci-amex/,20,0,Canonical mismatch; Orphaned
https://dolarexpress.cl/cupo-dolar-bancoestado-puerto-montt/,Cupo Dólar BancoEstado Puerto Montt | DolarExpress,Convierte tu cupo en dólares de BancoEstado en Pue,Cupo Dólar BancoEstado en Puerto Montt,https://dolarexpress.cl/cupo-dolar-bci-temuco/,20,0,Canonical mismatch; Orphaned
https://dolarexpress.cl/cupo-dolar-bancoestado-rancagua/,Cupo Dólar BancoEstado Rancagua | DolarExpress,Convierte tu cupo en dólares de BancoEstado en Ran,Cupo Dólar BancoEstado en Rancagua,https://dolarexpress.cl/cupo-dolar-bci-temuco/,20,0,Canonical mismatch; Orphaned
https://dolarexpress.cl/cupo-dolar-bancoestado-santiago/,Cupo Dólar BancoEstado Santiago | DolarExpress,Convierte tu cupo en dólares de BancoEstado en San,Cupo Dólar BancoEstado en Santiago,https://dolarexpress.cl/cupo-dolar-bci-temuco/,20,0,Canonical mismatch; Orphaned
https://dolarexpress.cl/cupo-dolar-bancoestado-temuco/,Cupo Dólar BancoEstado Temuco | DolarExpress,Convierte tu cupo en dólares de BancoEstado en Tem,Cupo Dólar BancoEstado en Temuco,https://dolarexpress.cl/cupo-dolar-bci-temuco/,20,0,Canonical mismatch; Orphaned
https://dolarexpress.cl/cupo-dolar-bancoestado-valparaiso/,Cupo Dólar BancoEstado Valparaíso | DolarExpress,Convierte tu cupo en dólares de BancoEstado en Val,Cupo Dólar BancoEstado en Valparaíso,https://dolarexpress.cl/cupo-dolar-bci-temuco/,20,0,Canonical mismatch; Orphaned
https://dolarexpress.cl/cupo-dolar-bancoestado-vina-del-mar/,Cupo Dólar BancoEstado Viña del Mar | DolarExpress,Convierte tu cupo en dólares de BancoEstado en Viñ,Cupo Dólar BancoEstado en Viña del Mar,https://dolarexpress.cl/cupo-dolar-bci-temuco/,20,0,Canonical mismatch; Orphaned
https://dolarexpress.cl/cupo-dolar-bancoestado-visa-gold/,Cupo Dólar BancoEstado Visa Gold | DolarExpress,Convierte el cupo de tu Visa Gold de BancoEstado a,Cupo Dólar BancoEstado Visa Gold a Pesos,https://dolarexpress.cl/cupo-dolar-bci-amex/,20,0,Canonical mismatch; Orphaned
https://dolarexpress.cl/cupo-dolar-bancoestado-visa-platinum/,Cupo Dólar BancoEstado Visa Platinum | DolarExpres,Convierte el cupo de tu Visa Platinum de BancoEsta,Cupo Dólar BancoEstado Visa Platinum a Pesos,https://dolarexpress.cl/cupo-dolar-bci-amex/,20,0,Canonical mismatch; Orphaned
https://dolarexpress.cl/cupo-dolar-bancoestado-visa-signature/,Cupo Dólar BancoEstado Visa Signature | DolarExpre,Convierte el cupo de tu Visa Signature de BancoEst,Cupo Dólar BancoEstado Visa Signature a Pesos,https://dolarexpress.cl/cupo-dolar-bci-amex/,20,0,Canonical mismatch; Orphaned
https://dolarexpress.cl/cupo-dolar-bancoestado/,Cupo Dólar BancoEstado → Pesos en 15 min | DolarEx,Convierte tu cupo en dólares de BancoEstado a peso,Cupo Dólar BancoEstado → Pesos Chilenos,https://dolarexpress.cl/cupo-dolar-bancoestado.html,20,0,Canonical mismatch; Orphaned
https://dolarexpress.cl/cupo-dolar-bci-amex/,Cupo Dólar BCI American Express | DolarExpress,Convierte el cupo de tu American Express de BCI a ,Cupo Dólar BCI American Express a Pesos,https://dolarexpress.cl/cupo-dolar-bci-amex.html,20,0,Canonical mismatch; Orphaned
https://dolarexpress.cl/cupo-dolar-bci-antofagasta/,Cupo Dólar BCI Antofagasta | DolarExpress,Convierte tu cupo en dólares de BCI en Antofagasta,Cupo Dólar BCI en Antofagasta,https://dolarexpress.cl/cupo-dolar-bci-temuco/,20,0,Canonical mismatch; Orphaned
https://dolarexpress.cl/cupo-dolar-bci-concepcion/,Cupo Dólar BCI Concepción | DolarExpress,Convierte tu cupo en dólares de BCI en Concepción ,Cupo Dólar BCI en Concepción,https://dolarexpress.cl/cupo-dolar-bci-temuco/,20,0,Canonical mismatch; Orphaned
https://dolarexpress.cl/cupo-dolar-bci-iquique/,Cupo Dólar BCI Iquique | DolarExpress,Convierte tu cupo en dólares de BCI en Iquique a p,Cupo Dólar BCI en Iquique,https://dolarexpress.cl/cupo-dolar-bci-temuco/,20,0,Canonical mismatch; Orphaned
https://dolarexpress.cl/cupo-dolar-bci-la-serena/,Cupo Dólar BCI La Serena | DolarExpress,Convierte tu cupo en dólares de BCI en La Serena a,Cupo Dólar BCI en La Serena,https://dolarexpress.cl/cupo-dolar-bci-temuco/,20,0,Canonical mismatch; Orphaned
https://dolarexpress.cl/cupo-dolar-bci-mastercard-black/,Cupo Dólar BCI Mastercard Black | DolarExpress,Convierte el cupo de tu Mastercard Black de BCI a ,Cupo Dólar BCI Mastercard Black a Pesos,https://dolarexpress.cl/cupo-dolar-bci-amex/,20,0,Canonical mismatch; Orphaned
https://dolarexpress.cl/cupo-dolar-bci-mastercard-gold/,Cupo Dólar BCI Mastercard Gold | DolarExpress,Convierte el cupo de tu Mastercard Gold de BCI a p,Cupo Dólar BCI Mastercard Gold a Pesos,https://dolarexpress.cl/cupo-dolar-bci-amex/,20,0,Canonical mismatch; Orphaned
https://dolarexpress.cl/cupo-dolar-bci-mastercard-platinum/,Cupo Dólar BCI Mastercard Platinum | DolarExpress,Convierte el cupo de tu Mastercard Platinum de BCI,Cupo Dólar BCI Mastercard Platinum a Pesos,https://dolarexpress.cl/cupo-dolar-bci-amex/,20,0,Canonical mismatch; Orphaned
https://dolarexpress.cl/cupo-dolar-bci-puerto-montt/,Cupo Dólar BCI Puerto Montt | DolarExpress,Convierte tu cupo en dólares de BCI en Puerto Mont,Cupo Dólar BCI en Puerto Montt,https://dolarexpress.cl/cupo-dolar-bci-temuco/,20,0,Canonical mismatch; Orphaned
https://dolarexpress.cl/cupo-dolar-bci-rancagua/,Cupo Dólar BCI Rancagua | DolarExpress,Convierte tu cupo en dólares de BCI en Rancagua a ,Cupo Dólar BCI en Rancagua,https://dolarexpress.cl/cupo-dolar-bci-temuco/,20,0,Canonical mismatch; Orphaned
https://dolarexpress.cl/cupo-dolar-bci-santiago/,Cupo Dólar BCI Santiago | DolarExpress,Convierte tu cupo en dólares de BCI en Santiago a ,Cupo Dólar BCI en Santiago,https://dolarexpress.cl/cupo-dolar-bci-temuco/,20,0,Canonical mismatch; Orphaned
https://dolarexpress.cl/cupo-dolar-bci-temuco/,Cupo Dólar BCI Temuco | DolarExpress,Convierte tu cupo en dólares de BCI en Temuco a pe,Cupo Dólar BCI en Temuco,https://dolarexpress.cl/cupo-dolar-bci-temuco.html,20,0,Canonical mismatch; Orphaned
https://dolarexpress.cl/cupo-dolar-bci-valparaiso/,Cupo Dólar BCI Valparaíso | DolarExpress,Convierte tu cupo en dólares de BCI en Valparaíso ,Cupo Dólar BCI en Valparaíso,https://dolarexpress.cl/cupo-dolar-bci-temuco/,20,0,Canonical mismatch; Orphaned
https://dolarexpress.cl/cupo-dolar-bci-vina-del-mar/,Cupo Dólar BCI Viña del Mar | DolarExpress,Convierte tu cupo en dólares de BCI en Viña del Ma,Cupo Dólar BCI en Viña del Mar,https://dolarexpress.cl/cupo-dolar-bci-temuco/,20,0,Canonical mismatch; Orphaned
https://dolarexpress.cl/cupo-dolar-bci-visa-gold/,Cupo Dólar BCI Visa Gold | DolarExpress,Convierte el cupo de tu Visa Gold de BCI a pesos e,Cupo Dólar BCI Visa Gold a Pesos,https://dolarexpress.cl/cupo-dolar-bci-amex/,20,0,Canonical mismatch; Orphaned
https://dolarexpress.cl/cupo-dolar-bci-visa-platinum/,Cupo Dólar BCI Visa Platinum | DolarExpress,Convierte el cupo de tu Visa Platinum de BCI a pes,Cupo Dólar BCI Visa Platinum a Pesos,https://dolarexpress.cl/cupo-dolar-bci-amex/,20,0,Canonical mismatch; Orphaned
https://dolarexpress.cl/cupo-dolar-bci-visa-signature/,Cupo Dólar BCI Visa Signature | DolarExpress,Convierte el cupo de tu Visa Signature de BCI a pe,Cupo Dólar BCI Visa Signature a Pesos,https://dolarexpress.cl/cupo-dolar-bci-amex/,20,0,Canonical mismatch; Orphaned
https://dolarexpress.cl/cupo-dolar-bci/,Cupo Dólar BCI Chile | DolarExpress,¿Tienes cupo en dólares en BCI? Recibe pesos chile,Vende tu cupo dólar BCI,https://dolarexpress.cl/cupo-dolar-bci.html,17,0,Canonical mismatch; Orphaned
https://dolarexpress.cl/cupo-dolar-bice/,Cupo Dólar BICE Chile | DolarExpress,¿Tienes cupo en dólares en BICE? Recibe pesos chil,Vende tu cupo dólar BICE,https://dolarexpress.cl/cupo-dolar-bice,17,0,Orphaned
https://dolarexpress.cl/cupo-dolar-calama/,Cupo Dólar en Calama — DolarExpress | DolarExpress,Servicio de cambio de cupo en dólares en Calama. A,Vende tu cupo en dólares en Calama y recibe pesos ,https://dolarexpress.cl/cupo-dolar-arica/,17,0,Canonical mismatch; Orphaned
https://dolarexpress.cl/cupo-dolar-chillan/,Cupo Dólar en Chillán — DolarExpress | DolarExpres,Servicio de cambio de cupo en dólares en Chillán. ,Vende tu cupo en dólares en Chillán y recibe pesos,https://dolarexpress.cl/cupo-dolar-arica/,17,0,Canonical mismatch; Orphaned
https://dolarexpress.cl/cupo-dolar-cmr/,Cupo Dólar CMR Falabella Chile | DolarExpress,Convierte el cupo en dólares de tu tarjeta CMR Fal,Vende tu cupo dólar CMR Falabella,https://dolarexpress.cl/cupo-dolar-cmr,17,0,Orphaned
https://dolarexpress.cl/cupo-dolar-como-funciona/,Cómo Funciona el Cupo Dólar en Chile | DolarExpres,Entérate cómo funciona el cupo en dólares de las t,Así funciona el cupo dólar en Chile,https://dolarexpress.cl/cupo-dolar-como-funciona,17,0,Orphaned
https://dolarexpress.cl/cupo-dolar-concepcion/,Cupo Dólar en Concepción — DolarExpress | DolarExp,Servicio de cambio de cupo en dólares en Concepció,Vende tu cupo en dólares en Concepción y recibe pe,https://dolarexpress.cl/cupo-dolar-arica/,17,0,Canonical mismatch; Orphaned
https://dolarexpress.cl/cupo-dolar-confiable/,Servicio Confiable de Cupo Dólar Chile | DolarExpr,DolarExpress ofrece un servicio confiable y transp,El servicio más confiable para tu cupo en dólares,https://dolarexpress.cl/cupo-dolar-confiable,17,0,Orphaned
https://dolarexpress.cl/cupo-dolar-conviene/,¿Conviene Vender el Cupo en Dólares? | DolarExpres,Analizamos cuándo conviene y cuándo no vender el c,¿Te conviene vender tu cupo en dólares hoy?,https://dolarexpress.cl/cupo-dolar-conviene,17,0,Orphaned
https://dolarexpress.cl/cupo-dolar-copiapo/,Cupo Dólar en Copiapó — DolarExpress | DolarExpres,Servicio de cambio de cupo en dólares en Copiapó. ,Vende tu cupo en dólares en Copiapó y recibe pesos,https://dolarexpress.cl/cupo-dolar-arica/,17,0,Canonical mismatch; Orphaned
https://dolarexpress.cl/cupo-dolar-disponible/,Tengo Cupo Dólar Disponible ¿Qué Hago? | DolarExpr,Opciones para aprovechar tu cupo en dólares dispon,¿Qué puedes hacer con tu cupo dólar disponible?,https://dolarexpress.cl/cupo-dolar-disponible,17,0,Orphaned
https://dolarexpress.cl/cupo-dolar-empresas/,Cupo Dólar para Empresas Chile | DolarExpress,¿Tu empresa necesita liquidez en pesos usando cupo,Servicio de cupo dólar para empresas y personas ju,https://dolarexpress.cl/cupo-dolar-empresas,17,0,Orphaned
https://dolarexpress.cl/cupo-dolar-falabella/,Cupo Dólar Banco Falabella Chile | DolarExpress,Convierte el cupo en dólares de tu tarjeta Falabel,Vende tu cupo dólar Banco Falabella,https://dolarexpress.cl/cupo-dolar-falabella,17,0,Orphaned
https://dolarexpress.cl/cupo-dolar-fin-de-mes/,Usar Cupo Dólar a Fin de Mes Chile | DolarExpress,¿Necesitas liquidez a fin de mes? Convierte tu cup,Usa tu cupo dólar a fin de mes para tener liquidez,https://dolarexpress.cl/cupo-dolar-fin-de-mes,17,0,Orphaned
https://dolarexpress.cl/cupo-dolar-hoy-chile/,Cupo Dólar Hoy en Chile | DolarExpress,Cotiza hoy mismo el valor de tu cupo en dólares y ,Cotiza tu cupo dólar hoy en Chile,https://dolarexpress.cl/cupo-dolar-hoy-chile,17,0,Orphaned
https://dolarexpress.cl/cupo-dolar-internacional/,Cupo Internacional Tarjeta de Crédito Chile | Dola,Aprovecha el cupo internacional de tu tarjeta de c,Usa tu cupo internacional en dólares,https://dolarexpress.cl/cupo-dolar-internacional,17,0,Orphaned
https://dolarexpress.cl/cupo-dolar-iquique/,Cupo Dólar en Iquique — DolarExpress | DolarExpres,Servicio de cambio de cupo en dólares en Iquique. ,Vende tu cupo en dólares en Iquique y recibe pesos,https://dolarexpress.cl/cupo-dolar-arica/,17,0,Canonical mismatch; Orphaned
https://dolarexpress.cl/cupo-dolar-itau/,Cupo Dólar Itaú Chile | DolarExpress,¿Tienes cupo en dólares en Itaú? Conviértelo a pes,Vende tu cupo dólar Itaú,https://dolarexpress.cl/cupo-dolar-bci/,17,0,Canonical mismatch; Orphaned
https://dolarexpress.cl/cupo-dolar-la-serena/,Cupo Dólar en La Serena — DolarExpress | DolarExpr,Servicio de cambio de cupo en dólares en La Serena,Vende tu cupo en dólares en La Serena y recibe pes,https://dolarexpress.cl/cupo-dolar-arica/,17,0,Canonical mismatch; Orphaned
https://dolarexpress.cl/cupo-dolar-las-condes/,Cupo Dólar en Las Condes — DolarExpress | DolarExp,Servicio de cambio de cupo en dólares en Las Conde,Vende tu cupo en dólares en Las Condes y recibe pe,https://dolarexpress.cl/cupo-dolar-arica/,17,0,Canonical mismatch; Orphaned
https://dolarexpress.cl/cupo-dolar-mastercard/,Cupo Dólar Mastercard Chile | DolarExpress,Usa el cupo en dólares de tu Mastercard para recib,Vende el cupo dólar de tu Mastercard,https://dolarexpress.cl/cupo-dolar-mastercard,17,0,Orphaned
https://dolarexpress.cl/cupo-dolar-monto-minimo/,Monto Mínimo para Vender Cupo Dólar | DolarExpress,Descubre desde qué monto puedes vender tu cupo en ,¿Cuál es el monto mínimo para vender cupo dólar?,https://dolarexpress.cl/cupo-dolar-monto-minimo,17,0,Orphaned
https://dolarexpress.cl/cupo-dolar-online/,Cupo Dólar Online — Servicio 100% Digital Chile | ,Servicio de cupo dólar 100% online en Chile. Sin i,Vende tu cupo en dólares 100% online desde cualqui,https://dolarexpress.cl/cupo-dolar-online,17,0,Orphaned
https://dolarexpress.cl/cupo-dolar-osorno/,Cupo Dólar en Osorno — DolarExpress | DolarExpress,Servicio de cambio de cupo en dólares en Osorno. A,Vende tu cupo en dólares en Osorno y recibe pesos ,https://dolarexpress.cl/cupo-dolar-arica/,17,0,Canonical mismatch; Orphaned
https://dolarexpress.cl/cupo-dolar-persona-natural/,Cupo Dólar para Persona Natural Chile | DolarExpre,DolarExpress atiende a personas naturales que quie,Servicio de cupo dólar para personas naturales,https://dolarexpress.cl/cupo-dolar-persona-natural,17,0,Orphaned
https://dolarexpress.cl/cupo-dolar-primera-vez/,Vender Cupo Dólar por Primera Vez Chile | DolarExp,Guía para quienes quieren vender su cupo en dólare,¿Es tu primera vez vendiendo cupo dólar?,https://dolarexpress.cl/cupo-dolar-primera-vez,17,0,Orphaned
https://dolarexpress.cl/cupo-dolar-providencia/,Cupo Dólar en Providencia — DolarExpress | DolarEx,Servicio de cambio de cupo en dólares en Providenc,Vende tu cupo en dólares en Providencia y recibe p,https://dolarexpress.cl/cupo-dolar-arica/,17,0,Canonical mismatch; Orphaned
https://dolarexpress.cl/cupo-dolar-puerto-montt/,Cupo Dólar en Puerto Montt — DolarExpress | DolarE,Servicio de cambio de cupo en dólares en Puerto Mo,Vende tu cupo en dólares en Puerto Montt y recibe ,https://dolarexpress.cl/cupo-dolar-arica/,17,0,Canonical mismatch; Orphaned
https://dolarexpress.cl/cupo-dolar-punta-arenas/,Cupo Dólar en Punta Arenas — DolarExpress | DolarE,Servicio de cambio de cupo en dólares en Punta Are,Vende tu cupo en dólares en Punta Arenas y recibe ,https://dolarexpress.cl/cupo-dolar-arica/,17,0,Canonical mismatch; Orphaned
https://dolarexpress.cl/cupo-dolar-rancagua/,Cupo Dólar en Rancagua — DolarExpress | DolarExpre,Servicio de cambio de cupo en dólares en Rancagua.,Vende tu cupo en dólares en Rancagua y recibe peso,https://dolarexpress.cl/cupo-dolar-arica/,17,0,Canonical mismatch; Orphaned
https://dolarexpress.cl/cupo-dolar-rapido/,Vender Cupo Dólar Rápido en Chile | DolarExpress,El servicio más rápido para convertir cupo en dóla,La forma más rápida de convertir cupo dólar a peso,https://dolarexpress.cl/cupo-dolar-rapido,17,0,Orphaned
https://dolarexpress.cl/cupo-dolar-recomendado/,Servicio Recomendado de Cupo Dólar Chile | DolarEx,DolarExpress: el servicio recomendado para convert,El servicio recomendado para tu cupo dólar,https://dolarexpress.cl/cupo-dolar-recomendado,17,0,Orphaned
https://dolarexpress.cl/cupo-dolar-regiones-chile/,Cupo Dólar en Regiones de Chile | DolarExpress,DolarExpress atiende clientes de todas las regione,Servicio de cupo dólar para todo Chile,https://dolarexpress.cl/cupo-dolar-regiones-chile,17,0,Orphaned
https://dolarexpress.cl/cupo-dolar-requisitos/,Requisitos para Vender Cupo Dólar Chile | DolarExp,Conoce los requisitos mínimos para convertir tu cu,¿Qué necesitas para vender tu cupo en dólares?,https://dolarexpress.cl/cupo-dolar-requisitos,17,0,Orphaned
https://dolarexpress.cl/cupo-dolar-ripley/,Cupo Dólar Banco Ripley Chile | DolarExpress,Usa el cupo en dólares de tu tarjeta Ripley para r,Vende tu cupo dólar Banco Ripley,https://dolarexpress.cl/cupo-dolar-ripley,17,0,Orphaned
https://dolarexpress.cl/cupo-dolar-santander/,Cupo Dólar Santander Chile | DolarExpress,Convierte tu cupo en dólares del Banco Santander a,Vende tu cupo dólar Santander,https://dolarexpress.cl/cupo-dolar-santander,17,0,Orphaned
https://dolarexpress.cl/cupo-dolar-santiago/,Cupo Dólar en Santiago — DolarExpress | DolarExpre,Servicio de cambio de cupo en dólares en Santiago.,Vende tu cupo en dólares en Santiago y recibe peso,https://dolarexpress.cl/cupo-dolar-arica/,17,0,Canonical mismatch; Orphaned
https://dolarexpress.cl/cupo-dolar-scotiabank-temuco/,Cupo Dólar Scotiabank Temuco | DolarExpress,Convierte tu cupo en dólares de Scotiabank en Temu,Cupo Dólar Scotiabank en Temuco,https://dolarexpress.cl/cupo-dolar-bci-temuco/,20,0,Canonical mismatch; Orphaned
https://dolarexpress.cl/cupo-dolar-scotiabank-valparaiso/,Cupo Dólar Scotiabank Valparaíso | DolarExpress,Convierte tu cupo en dólares de Scotiabank en Valp,Cupo Dólar Scotiabank en Valparaíso,https://dolarexpress.cl/cupo-dolar-bci-temuco/,20,0,Canonical mismatch; Orphaned
https://dolarexpress.cl/cupo-dolar-scotiabank-vina-del-mar/,Cupo Dólar Scotiabank Viña del Mar | DolarExpress,Convierte tu cupo en dólares de Scotiabank en Viña,Cupo Dólar Scotiabank en Viña del Mar,https://dolarexpress.cl/cupo-dolar-bci-temuco/,20,0,Canonical mismatch; Orphaned
https://dolarexpress.cl/cupo-dolar-scotiabank-visa-gold/,Cupo Dólar Scotiabank Visa Gold | DolarExpress,Convierte el cupo de tu Visa Gold de Scotiabank a ,Cupo Dólar Scotiabank Visa Gold a Pesos,https://dolarexpress.cl/cupo-dolar-bci-amex/,20,0,Canonical mismatch; Orphaned
https://dolarexpress.cl/cupo-dolar-scotiabank-visa-platinum/,Cupo Dólar Scotiabank Visa Platinum | DolarExpress,Convierte el cupo de tu Visa Platinum de Scotiaban,Cupo Dólar Scotiabank Visa Platinum a Pesos,https://dolarexpress.cl/cupo-dolar-bci-amex/,20,0,Canonical mismatch; Orphaned
https://dolarexpress.cl/cupo-dolar-scotiabank-visa-signature/,Cupo Dólar Scotiabank Visa Signature | DolarExpres,Convierte el cupo de tu Visa Signature de Scotiaba,Cupo Dólar Scotiabank Visa Signature a Pesos,https://dolarexpress.cl/cupo-dolar-bci-amex/,20,0,Canonical mismatch; Orphaned
https://dolarexpress.cl/cupo-dolar-scotiabank/,Cupo Dólar Scotiabank Chile | DolarExpress,Usa el cupo en dólares de tu tarjeta Scotiabank pa,Vende tu cupo dólar Scotiabank,https://dolarexpress.cl/cupo-dolar-scotiabank,17,0,Orphaned
https://dolarexpress.cl/cupo-dolar-security-amex/,Cupo Dólar Banco Security American Express | Dolar,Convierte el cupo de tu American Express de Banco ,Cupo Dólar Banco Security American Express a Pesos,https://dolarexpress.cl/cupo-dolar-bci-amex/,20,0,Canonical mismatch; Orphaned
https://dolarexpress.cl/cupo-dolar-security-antofagasta/,Cupo Dólar Banco Security Antofagasta | DolarExpre,Convierte tu cupo en dólares de Banco Security en ,Cupo Dólar Banco Security en Antofagasta,https://dolarexpress.cl/cupo-dolar-bci-temuco/,20,0,Canonical mismatch; Orphaned
https://dolarexpress.cl/cupo-dolar-security-concepcion/,Cupo Dólar Banco Security Concepción | DolarExpres,Convierte tu cupo en dólares de Banco Security en ,Cupo Dólar Banco Security en Concepción,https://dolarexpress.cl/cupo-dolar-bci-temuco/,20,0,Canonical mismatch; Orphaned
https://dolarexpress.cl/cupo-dolar-security-iquique/,Cupo Dólar Banco Security Iquique | DolarExpress,Convierte tu cupo en dólares de Banco Security en ,Cupo Dólar Banco Security en Iquique,https://dolarexpress.cl/cupo-dolar-bci-temuco/,20,0,Canonical mismatch; Orphaned
https://dolarexpress.cl/cupo-dolar-security-la-serena/,Cupo Dólar Banco Security La Serena | DolarExpress,Convierte tu cupo en dólares de Banco Security en ,Cupo Dólar Banco Security en La Serena,https://dolarexpress.cl/cupo-dolar-bci-temuco/,20,0,Canonical mismatch; Orphaned
https://dolarexpress.cl/cupo-dolar-security-mastercard-black/,Cupo Dólar Banco Security Mastercard Black | Dolar,Convierte el cupo de tu Mastercard Black de Banco ,Cupo Dólar Banco Security Mastercard Black a Pesos,https://dolarexpress.cl/cupo-dolar-bci-amex/,20,0,Canonical mismatch; Orphaned
https://dolarexpress.cl/cupo-dolar-security-mastercard-gold/,Cupo Dólar Banco Security Mastercard Gold | DolarE,Convierte el cupo de tu Mastercard Gold de Banco S,Cupo Dólar Banco Security Mastercard Gold a Pesos,https://dolarexpress.cl/cupo-dolar-bci-amex/,20,0,Canonical mismatch; Orphaned
https://dolarexpress.cl/cupo-dolar-security-mastercard-platinum/,Cupo Dólar Banco Security Mastercard Platinum | Do,Convierte el cupo de tu Mastercard Platinum de Ban,Cupo Dólar Banco Security Mastercard Platinum a Pe,https://dolarexpress.cl/cupo-dolar-bci-amex/,20,0,Canonical mismatch; Orphaned
https://dolarexpress.cl/cupo-dolar-security-puerto-montt/,Cupo Dólar Banco Security Puerto Montt | DolarExpr,Convierte tu cupo en dólares de Banco Security en ,Cupo Dólar Banco Security en Puerto Montt,https://dolarexpress.cl/cupo-dolar-bci-temuco/,20,0,Canonical mismatch; Orphaned
https://dolarexpress.cl/cupo-dolar-security-rancagua/,Cupo Dólar Banco Security Rancagua | DolarExpress,Convierte tu cupo en dólares de Banco Security en ,Cupo Dólar Banco Security en Rancagua,https://dolarexpress.cl/cupo-dolar-bci-temuco/,20,0,Canonical mismatch; Orphaned
https://dolarexpress.cl/cupo-dolar-security-santiago/,Cupo Dólar Banco Security Santiago | DolarExpress,Convierte tu cupo en dólares de Banco Security en ,Cupo Dólar Banco Security en Santiago,https://dolarexpress.cl/cupo-dolar-bci-temuco/,20,0,Canonical mismatch; Orphaned
https://dolarexpress.cl/cupo-dolar-security-temuco/,Cupo Dólar Banco Security Temuco | DolarExpress,Convierte tu cupo en dólares de Banco Security en ,Cupo Dólar Banco Security en Temuco,https://dolarexpress.cl/cupo-dolar-bci-temuco/,20,0,Canonical mismatch; Orphaned
