URL,Title,Description,H1,Canonical,Total_Links,Links_In,Issues
https://dolarexpress.cl/cupo-dolar-security-valparaiso/,Cupo Dólar Banco Security Valparaíso | DolarExpres,Convierte tu cupo en dólares de Banco Security en ,Cupo Dólar Banco Security en Valparaíso,https://dolarexpress.cl/cupo-dolar-bci-temuco/,20,0,Canonical mismatch; Orphaned
https://dolarexpress.cl/cupo-dolar-security-vina-del-mar/,Cupo Dólar Banco Security Viña del Mar | DolarExpr,Convierte tu cupo en dólares de Banco Security en ,Cupo Dólar Banco Security en Viña del Mar,https://dolarexpress.cl/cupo-dolar-bci-temuco/,20,0,Canonical mismatch; Orphaned
https://dolarexpress.cl/cupo-dolar-security-visa-gold/,Cupo Dólar Banco Security Visa Gold | DolarExpress,Convierte el cupo de tu Visa Gold de Banco Securit,Cupo Dólar Banco Security Visa Gold a Pesos,https://dolarexpress.cl/cupo-dolar-bci-amex/,20,0,Canonical mismatch; Orphaned
https://dolarexpress.cl/cupo-dolar-security-visa-platinum/,Cupo Dólar Banco Security Visa Platinum | DolarExp,Convierte el cupo de tu Visa Platinum de Banco Sec,Cupo Dólar Banco Security Visa Platinum a Pesos,https://dolarexpress.cl/cupo-dolar-bci-amex/,20,0,Canonical mismatch; Orphaned
https://dolarexpress.cl/cupo-dolar-security-visa-signature/,Cupo Dólar Banco Security Visa Signature | DolarEx,Convierte el cupo de tu Visa Signature de Banco Se,Cupo Dólar Banco Security Visa Signature a Pesos,https://dolarexpress.cl/cupo-dolar-bci-amex/,20,0,Canonical mismatch; Orphaned
https://dolarexpress.cl/cupo-dolar-security/,Cupo Dólar Banco Security Chile | DolarExpress,Convierte tu cupo en dólares del Banco Security a ,Vende tu cupo dólar Banco Security,https://dolarexpress.cl/cupo-dolar-security.html,17,0,Canonical mismatch; Orphaned
https://dolarexpress.cl/cupo-dolar-seguro/,¿Es Seguro Vender Cupo Dólar en Chile? | DolarExpr,Conoce cómo funciona un servicio seguro para conve,Vende tu cupo dólar de forma segura en Chile,https://dolarexpress.cl/cupo-dolar-seguro.html,17,0,Canonical mismatch; Orphaned
https://dolarexpress.cl/cupo-dolar-sin-complicaciones/,Vender Cupo Dólar Sin Complicaciones Chile | Dolar,El proceso más simple para convertir tu cupo en dó,La forma más simple de vender tu cupo dólar,https://dolarexpress.cl/cupo-dolar-sin-complicaciones.html,17,0,Canonical mismatch; Orphaned
https://dolarexpress.cl/cupo-dolar-sin-cuenta-bancaria/,Cupo Dólar Sin Cuenta Bancaria | DolarExpress,Alternativas para recibir tu dinero sin cuenta cor,Cupo Dólar Sin Cuenta Bancaria,https://dolarexpress.cl/cupo-dolar-tarjeta-empresas/,20,0,Canonical mismatch; Orphaned
https://dolarexpress.cl/cupo-dolar-sin-estafa/,Cómo Evitar Estafas al Vender Cupo Dólar | DolarEx,Tips para identificar un servicio confiable al ven,Vende tu cupo dólar sin riesgo de estafa,https://dolarexpress.cl/cupo-dolar-sin-estafa.html,17,0,Canonical mismatch; Orphaned
https://dolarexpress.cl/cupo-dolar-sin-monto-minimo/,Cupo Dólar Sin Monto Mínimo Chile | DolarExpress,Conoce los montos mínimos para operar cupo dólar e,¿Cuánto es el monto mínimo para vender cupo dólar?,https://dolarexpress.cl/cupo-dolar-sin-monto-minimo.html,17,0,Canonical mismatch; Orphaned
https://dolarexpress.cl/cupo-dolar-sin-usar/,Tengo Cupo Dólar Sin Usar en Chile | DolarExpress,"Si tienes cupo en dólares disponible sin usar, Dol",¿Tienes cupo en dólares sin usar? Conviértelo,https://dolarexpress.cl/cupo-dolar-sin-usar.html,17,0,Canonical mismatch; Orphaned
https://dolarexpress.cl/cupo-dolar-talca/,Cupo Dólar en Talca — DolarExpress | DolarExpress,Servicio de cambio de cupo en dólares en Talca. At,Vende tu cupo en dólares en Talca y recibe pesos h,https://dolarexpress.cl/cupo-dolar-arica/,17,0,Canonical mismatch; Orphaned
https://dolarexpress.cl/cupo-dolar-tarjeta-bloqueada/,Cupo Dólar Tarjeta Bloqueada | DolarExpress,Qué hacer si tu tarjeta está bloqueada para compra,Cupo Dólar Tarjeta Bloqueada,https://dolarexpress.cl/cupo-dolar-tarjeta-empresas/,20,0,Canonical mismatch; Orphaned
https://dolarexpress.cl/cupo-dolar-tarjeta-empresas/,Cupo Dólar Tarjeta Empresa | DolarExpress,Cómo usar el cupo internacional de tu tarjeta corp,Cupo Dólar Tarjeta Empresa,https://dolarexpress.cl/cupo-dolar-tarjeta-empresas.html,20,0,Canonical mismatch; Orphaned
https://dolarexpress.cl/cupo-dolar-temuco/,Cupo Dólar en Temuco — DolarExpress | DolarExpress,Servicio de cambio de cupo en dólares en Temuco. A,Vende tu cupo en dólares en Temuco y recibe pesos ,https://dolarexpress.cl/cupo-dolar-arica/,17,0,Canonical mismatch; Orphaned
https://dolarexpress.cl/cupo-dolar-tiempo/,¿Cuánto Tarda Convertir Cupo Dólar a Pesos? | Dola,Conoce los tiempos reales para convertir tu cupo e,Tiempos reales para convertir cupo dólar a pesos,https://dolarexpress.cl/cupo-dolar-tiempo.html,17,0,Canonical mismatch; Orphaned
https://dolarexpress.cl/cupo-dolar-transferencia-inmediata/,Cupo Dólar con Transferencia Inmediata Chile | Dol,Convierte tu cupo en dólares a pesos chilenos con ,Vende tu cupo dólar y recibe transferencia inmedia,https://dolarexpress.cl/cupo-dolar-transferencia-inmediata.html,17,0,Canonical mismatch; Orphaned
https://dolarexpress.cl/cupo-dolar-urgente/,Vender Cupo Dólar Urgente Chile | DolarExpress,Servicio de conversión urgente de cupo en dólares ,¿Necesitas vender tu cupo dólar de forma urgente?,https://dolarexpress.cl/cupo-dolar-urgente.html,17,0,Canonical mismatch; Orphaned
https://dolarexpress.cl/cupo-dolar-valdivia/,Cupo Dólar en Valdivia — DolarExpress | DolarExpre,Servicio de cambio de cupo en dólares en Valdivia.,Vende tu cupo en dólares en Valdivia y recibe peso,https://dolarexpress.cl/cupo-dolar-arica/,17,0,Canonical mismatch; Orphaned
https://dolarexpress.cl/cupo-dolar-valparaiso/,Cupo Dólar en Valparaíso — DolarExpress | DolarExp,Servicio de cambio de cupo en dólares en Valparaís,Vende tu cupo en dólares en Valparaíso y recibe pe,https://dolarexpress.cl/cupo-dolar-arica/,17,0,Canonical mismatch; Orphaned
https://dolarexpress.cl/cupo-dolar-vina-del-mar/,Cupo Dólar en Viña del Mar — DolarExpress | DolarE,Servicio de cambio de cupo en dólares en Viña del ,Vende tu cupo en dólares en Viña del Mar y recibe ,https://dolarexpress.cl/cupo-dolar-arica/,17,0,Canonical mismatch; Orphaned
https://dolarexpress.cl/cupo-dolar-visa-gold/,Cupo Dólar Visa Gold → Pesos Chilenos | DolarExpre,Convierte el cupo en dólares de tu Visa Gold a pes,Cupo Dólar Visa Gold a Pesos Chilenos,https://dolarexpress.cl/cupo-dolar-amex/,20,0,Canonical mismatch; Orphaned
https://dolarexpress.cl/cupo-dolar-visa-platinum/,Cupo Dólar Visa Platinum → Pesos Chilenos | DolarE,Convierte el cupo en dólares de tu Visa Platinum a,Cupo Dólar Visa Platinum a Pesos Chilenos,https://dolarexpress.cl/cupo-dolar-amex/,20,0,Canonical mismatch; Orphaned
https://dolarexpress.cl/cupo-dolar-visa-signature/,Cupo Dólar Visa Signature → Pesos Chilenos | Dolar,Convierte el cupo en dólares de tu Visa Signature ,Cupo Dólar Visa Signature a Pesos Chilenos,https://dolarexpress.cl/cupo-dolar-amex/,20,0,Canonical mismatch; Orphaned
https://dolarexpress.cl/cupo-dolar-visa/,Cupo Dólar Tarjeta Visa Chile | DolarExpress,Convierte el cupo en dólares de tu tarjeta Visa a ,Vende el cupo dólar de tu Visa,https://dolarexpress.cl/cupo-dolar-visa.html,17,0,Canonical mismatch; Orphaned
https://dolarexpress.cl/cupo-dolar-whatsapp/,Vender Cupo Dólar por WhatsApp Chile | DolarExpres,El servicio más conveniente para vender tu cupo en,Vende tu cupo dólar directo por WhatsApp,https://dolarexpress.cl/cupo-dolar-whatsapp.html,17,0,Canonical mismatch; Orphaned
https://dolarexpress.cl/cupo-dolares-tarjeta-credito/,Cupo en Dólares Tarjeta de Crédito Chile | DolarEx,¿Tienes cupo disponible en dólares en tu tarjeta d,Convierte tu cupo en dólares de tarjeta de crédito,https://dolarexpress.cl/cupo-dolares-tarjeta-credito,17,0,Orphaned
https://dolarexpress.cl/cupo-en-dolares/,Cupo en Dólares — Cómo Usarlo en Chile | DolarExpr,Aprende cómo usar tu cupo en dólares para obtener ,¿Tienes cupo en dólares? Conviértelo en pesos chil,https://dolarexpress.cl/cupo-en-dolares.html,17,0,Canonical mismatch; Orphaned
https://dolarexpress.cl/cupo-internacional-a-pesos/,Cupo Internacional a Pesos Chilenos | DolarExpress,Convierte tu cupo internacional a pesos a pesos ch,Cupo Internacional a Pesos Chilenos,https://dolarexpress.cl/cupo-internacional-bci/,20,0,Canonical mismatch; Orphaned
https://dolarexpress.cl/cupo-internacional-banco-chile/,Cupo Internacional Banco de Chile | DolarExpress,Convierte tu cupo internacional banco de chile a p,Cupo Internacional Banco de Chile,https://dolarexpress.cl/cupo-internacional-bci/,20,0,Canonical mismatch; Orphaned
https://dolarexpress.cl/cupo-internacional-bancoestado/,Cupo Internacional BancoEstado | DolarExpress,Convierte tu cupo internacional bancoestado a peso,Cupo Internacional BancoEstado,https://dolarexpress.cl/cupo-internacional-bci/,20,0,Canonical mismatch; Orphaned
https://dolarexpress.cl/cupo-internacional-bci/,Cupo Internacional BCI a Pesos | DolarExpress,Convierte tu cupo internacional bci a pesos chilen,Cupo Internacional BCI a Pesos,https://dolarexpress.cl/cupo-internacional-bci.html,20,0,Canonical mismatch; Orphaned
https://dolarexpress.cl/cupo-internacional-santander/,Cupo Internacional Santander Chile | DolarExpress,Convierte tu cupo internacional santander a pesos ,Cupo Internacional Santander Chile,https://dolarexpress.cl/cupo-internacional-bci/,20,0,Canonical mismatch; Orphaned
https://dolarexpress.cl/cupo-internacional-tarjeta-credito/,Cupo Internacional Tarjeta de Crédito Chile | Dola,Convierte tu cupo internacional tarjeta de crédito,Cupo Internacional Tarjeta de Crédito Chile,https://dolarexpress.cl/cupo-internacional-bci/,20,0,Canonical mismatch; Orphaned
https://dolarexpress.cl/cupo-internacional-tarjeta/,Cupo Internacional Tarjeta Chile | DolarExpress,Usa el cupo internacional de tu tarjeta de crédito,Aprovecha el cupo internacional de tu tarjeta,https://dolarexpress.cl/cupo-internacional-tarjeta.html,17,0,Canonical mismatch; Orphaned
https://dolarexpress.cl/cupo-para-compras-a-efectivo-chile/,"Cupo Para Compras A Efectivo Chile: Proceso, Costo","Cupo Para Compras A Efectivo Chile: comisión 15%, ",Cupo Para Compras A Efectivo Chile,https://dolarexpress.cl/sacar-plata-ripley/,20,0,Canonical mismatch; Orphaned
https://dolarexpress.cl/cupo-tarjeta-a-transferencia/,Transferir Cupo tu tarjeta de tienda a Cuenta Banc,Transfiere cupo tu tarjeta de tienda a tu cuenta b,Cupo Tarjeta A Transferencia,https://dolarexpress.cl/sacar-plata-ripley/,20,0,Canonical mismatch; Orphaned
https://dolarexpress.cl/cupo-usd-a-clp/,Cupo USD a CLP en Chile | DolarExpress,Servicio de conversión de cupo en USD a CLP para t,Convierte tu cupo USD a CLP hoy,https://dolarexpress.cl/cupo-usd-a-clp.html,17,0,Canonical mismatch; Orphaned
https://dolarexpress.cl/directorio-general/,Directorio de Servicios Financieros | DolarExpress,Mapa del sitio completo. Servicios de liquidación ,Directorio Maestro de URLs DolarExpress,https://dolarexpress.cl/directorio-general.html,290,0,Canonical mismatch; Orphaned
https://dolarexpress.cl/efectivo-cupo-dolar/,Efectivo con Cupo Dólar Chile | DolarExpress,Transforma tu cupo en dólares en pesos chilenos po,Recibe pesos en efectivo usando tu cupo dólar,https://dolarexpress.cl/efectivo-cupo-dolar.html,17,0,Canonical mismatch; Orphaned
https://dolarexpress.cl/es-legal-vender-cupo-dolar/,¿Es Legal Vender Cupo en Dólares en Chile? | Dolar,Resuelve tus dudas sobre la legalidad de vender cu,¿Es legal vender el cupo en dólares de tu tarjeta?,https://dolarexpress.cl/es-legal-vender-cupo-dolar.html,17,0,Canonical mismatch; Orphaned
https://dolarexpress.cl/girar-cupo-dolares/,Girar Cupo en Dólares Chile | DolarExpress,Servicio para girar tu cupo en dólares de tarjeta ,Gira tu cupo en dólares y recibe pesos chilenos,https://dolarexpress.cl/girar-cupo-dolares.html,17,0,Canonical mismatch; Orphaned
https://dolarexpress.cl/girar-dolares-tarjeta/,Girar Dólares desde Tarjeta de Crédito en Chile | ,Gira los dólares disponibles en tu tarjeta de créd,Gira dólares desde tu tarjeta de crédito y recibe ,https://dolarexpress.cl/girar-dolares-tarjeta.html,17,0,Canonical mismatch; Orphaned
https://dolarexpress.cl/hites-plata-rapido/,Efectivo con Hites en 25 minutos: Proceso y Costos,Efectivo en 25 minutos con Hites. Comisión 15%. Cr,Hites Plata RáPido,https://dolarexpress.cl/hites-plata-rapido/,20,0,Orphaned
https://dolarexpress.cl/,Vender Cupo en Dólares a Pesos | Transferencia Inm,¿Necesitas liquidez? Compramos tu cupo en dólares ,Vende tu Cupo en Dólares a Pesos,https://dolarexpress.cl/,16,0,Orphaned
https://dolarexpress.cl/liquidar-cupo-dolar/,Liquidar Cupo en Dólares Chile | DolarExpress,Liquidación de cupo en dólares a pesos chilenos. P,Liquida tu cupo en dólares y recibe pesos al insta,https://dolarexpress.cl/liquidar-cupo-dolar.html,17,0,Canonical mismatch; Orphaned
https://dolarexpress.cl/liquidez-cupo-dolar/,Liquidez con Cupo en Dólares Chile | DolarExpress,Convierte tu cupo en dólares en liquidez en pesos ,Obtén liquidez inmediata con tu cupo dólar,https://dolarexpress.cl/liquidez-cupo-dolar.html,17,0,Canonical mismatch; Orphaned
https://dolarexpress.cl/mejor-tasa-cupo-dolar/,Mejor Tasa para Cupo Dólar en Chile | DolarExpress,Cómo obtener la mejor tasa al convertir tu cupo en,Consigue la mejor tasa para tu cupo en dólares,https://dolarexpress.cl/mejor-tasa-cupo-dolar.html,17,0,Canonical mismatch; Orphaned
https://dolarexpress.cl/necesito-pesos-tengo-dolares/,Necesito Pesos y Tengo Dólares en Chile | DolarExp,Si tienes cupo en dólares y necesitas pesos chilen,¿Necesitas pesos urgente y tienes cupo en dólares?,https://dolarexpress.cl/necesito-pesos-tengo-dolares.html,17,0,Canonical mismatch; Orphaned
https://dolarexpress.cl/necesito-plata-y-tengo-cupo-en-tarjeta/,Efectivo desde Tarjeta de Tienda: Costos y Riesgos,Tarjeta de tienda a efectivo: costos reales (15% c,Necesito Plata Y Tengo Cupo En Tarjeta,https://dolarexpress.cl/sacar-plata-ripley/,20,0,Canonical mismatch; Orphaned
https://dolarexpress.cl/pagar-con-cupo-dolar/,Pagar Deudas con Cupo Dólar Chile | DolarExpress,Convierte tu cupo en dólares en pesos chilenos par,Usa tu cupo dólar para obtener liquidez y pagar de,https://dolarexpress.cl/pagar-con-cupo-dolar.html,17,0,Canonical mismatch; Orphaned
https://dolarexpress.cl/page1/,Page 1,,This is Page 1,https://dolarexpress.cl/page1.html,2,0,No description; Canonical mismatch; Orphaned
https://dolarexpress.cl/pasar-cupo-de-compras-a-efectivo/,Cupo de Compras tu tarjeta de tienda a Efectivo: C,Convierte cupo de compras tu tarjeta de tienda en ,Pasar Cupo De Compras A Efectivo,https://dolarexpress.cl/cupo-compras-a-efectivo-ripley/,20,0,Canonical mismatch; Orphaned
https://dolarexpress.cl/plata-rapida-con-tarjeta-retail-chile/,"Plata RáPida Con Tarjeta Retail Chile: Proceso, Co",Plata RáPida Con Tarjeta Retail Chile: comisión 15,Plata RáPida Con Tarjeta Retail Chile,https://dolarexpress.cl/sacar-plata-ripley/,20,0,Canonical mismatch; Orphaned
https://dolarexpress.cl/privacidad/,Política de Privacidad | DolarExpress,Política de privacidad de DolarExpress. Conoce cóm,Política de Privacidad,https://dolarexpress.cl/privacidad.html,4,0,Canonical mismatch; Orphaned
https://dolarexpress.cl/que-es-cupo-dolar/,¿Qué es el Cupo en Dólares de tu Tarjeta? | DolarE,Explicación clara de qué es el cupo en dólares de ,¿Qué es el cupo en dólares y cómo usarlo?,https://dolarexpress.cl/que-es-cupo-dolar.html,17,0,Canonical mismatch; Orphaned
https://dolarexpress.cl/riesgos-vender-cupo-dolar/,Riesgos de Vender Cupo en Dólares Chile | DolarExp,Conoce los riesgos y cuidados al vender tu cupo en,¿Cuáles son los riesgos de vender tu cupo dólar?,https://dolarexpress.cl/riesgos-vender-cupo-dolar.html,17,0,Canonical mismatch; Orphaned
https://dolarexpress.cl/ripley-plata-al-tiro/,Efectivo con Ripley en 20 minutos: Proceso y Costo,Efectivo en 20 minutos con Ripley. Comisión 15%. C,Ripley Plata Al Tiro,https://dolarexpress.cl/sacar-plata-ripley/,20,0,Canonical mismatch; Orphaned
https://dolarexpress.cl/sacar-cupo-dolares/,Sacar Cupo en Dólares Chile | DolarExpress,¿Quieres sacar tu cupo en dólares? Recibe pesos ch,Saca tu cupo en dólares y recibe pesos al instante,https://dolarexpress.cl/sacar-cupo-dolares.html,17,0,Canonical mismatch; Orphaned
https://dolarexpress.cl/sacar-dinero-tarjeta-abc-din/,"Sacar Dinero Tarjeta Abc Din: Proceso, Costos y Ri","Sacar Dinero Tarjeta Abc Din: comisión 15%, proces",Sacar Dinero Tarjeta Abc Din,https://dolarexpress.cl/avance-abc-visa/,20,0,Canonical mismatch; Orphaned
https://dolarexpress.cl/sacar-dinero-tarjeta-casa-comercial/,"Sacar Dinero Tarjeta Casa Comercial: Proceso, Cost","Sacar Dinero Tarjeta Casa Comercial: comisión 15%,",Sacar Dinero Tarjeta Casa Comercial,https://dolarexpress.cl/sacar-plata-ripley/,20,0,Canonical mismatch; Orphaned
https://dolarexpress.cl/sacar-dinero-tarjeta-cmr-falabella/,"Sacar Dinero Tarjeta Cmr Falabella: Proceso, Costo","Sacar Dinero Tarjeta Cmr Falabella: comisión 15%, ",Sacar Dinero Tarjeta Cmr Falabella,https://dolarexpress.cl/sacar-plata-cmr/,20,0,Canonical mismatch; Orphaned
https://dolarexpress.cl/sacar-dinero-tarjeta-hites/,"Sacar Dinero Tarjeta Hites: Proceso, Costos y Ries","Sacar Dinero Tarjeta Hites: comisión 15%, proceso ",Sacar Dinero Tarjeta Hites,https://dolarexpress.cl/hites-plata-rapido/,20,0,Canonical mismatch; Orphaned
https://dolarexpress.cl/sacar-dinero-tarjeta-jumbo/,"Sacar Dinero Tarjeta Jumbo: Proceso, Costos y Ries","Sacar Dinero Tarjeta Jumbo: comisión 15%, proceso ",Sacar Dinero Tarjeta Jumbo,https://dolarexpress.cl/avance-tarjeta-easy/,20,0,Canonical mismatch; Orphaned
https://dolarexpress.cl/sacar-dinero-tarjeta-la-polar/,"Sacar Dinero Tarjeta La Polar: Proceso, Costos y R","Sacar Dinero Tarjeta La Polar: comisión 15%, proce",Sacar Dinero Tarjeta La Polar,https://dolarexpress.cl/avance-la-polar-cuotas/,20,0,Canonical mismatch; Orphaned
https://dolarexpress.cl/sacar-dinero-tarjeta-lider/,"Sacar Dinero Tarjeta Lider: Proceso, Costos y Ries","Sacar Dinero Tarjeta Lider: comisión 15%, proceso ",Sacar Dinero Tarjeta Lider,https://dolarexpress.cl/avance-lider-bci-online/,20,0,Canonical mismatch; Orphaned
https://dolarexpress.cl/sacar-dinero-tarjeta-paris/,"Sacar Dinero Tarjeta Paris: Proceso, Costos y Ries","Sacar Dinero Tarjeta Paris: comisión 15%, proceso ",Sacar Dinero Tarjeta Paris,https://dolarexpress.cl/avance-tarjeta-easy/,20,0,Canonical mismatch; Orphaned
https://dolarexpress.cl/sacar-dinero-tarjeta-ripley/,"Sacar Dinero Tarjeta Ripley: Proceso, Costos y Rie","Sacar Dinero Tarjeta Ripley: comisión 15%, proceso",Sacar Dinero Tarjeta Ripley,https://dolarexpress.cl/sacar-plata-ripley/,20,0,Canonical mismatch; Orphaned
https://dolarexpress.cl/sacar-plata-cmr/,"Sacar Plata Cmr: Proceso, Costos y Riesgos | Dolar","Sacar Plata Cmr: comisión 15%, proceso en 15 minut",Sacar Plata Cmr,https://dolarexpress.cl/sacar-plata-cmr/,20,0,Orphaned
https://dolarexpress.cl/sacar-plata-de-tarjeta-de-tienda/,"Sacar Plata De Tarjeta De Tienda: Proceso, Costos ","Sacar Plata De Tarjeta De Tienda: comisión 15%, pr",Sacar Plata De Tarjeta De Tienda,https://dolarexpress.cl/sacar-plata-ripley/,20,0,Canonical mismatch; Orphaned
https://dolarexpress.cl/sacar-plata-ripley/,"Sacar Plata Ripley: Proceso, Costos y Riesgos | Do","Sacar Plata Ripley: comisión 15%, proceso en 20 mi",Sacar Plata Ripley,https://dolarexpress.cl/sacar-plata-ripley/,20,0,Orphaned
https://dolarexpress.cl/sacar-plata-tarjeta-abcdin/,"Sacar Plata Tarjeta Abcdin: Proceso, Costos y Ries","Sacar Plata Tarjeta Abcdin: comisión 15%, proceso ",Sacar Plata Tarjeta Abcdin,https://dolarexpress.cl/avance-abc-visa/,20,0,Canonical mismatch; Orphaned
https://dolarexpress.cl/sacar-plata-tarjeta-cencosud/,"Sacar Plata Tarjeta Cencosud: Proceso, Costos y Ri","Sacar Plata Tarjeta Cencosud: comisión 15%, proces",Sacar Plata Tarjeta Cencosud,https://dolarexpress.cl/avance-tarjeta-easy/,20,0,Canonical mismatch; Orphaned
https://dolarexpress.cl/sacar-plata-tarjeta-hites/,"Sacar Plata Tarjeta Hites: Proceso, Costos y Riesg","Sacar Plata Tarjeta Hites: comisión 15%, proceso e",Sacar Plata Tarjeta Hites,https://dolarexpress.cl/hites-plata-rapido/,20,0,Canonical mismatch; Orphaned
https://dolarexpress.cl/sacar-plata-tarjeta-lider/,"Sacar Plata Tarjeta Lider: Proceso, Costos y Riesg","Sacar Plata Tarjeta Lider: comisión 15%, proceso e",Sacar Plata Tarjeta Lider,https://dolarexpress.cl/avance-lider-bci-online/,20,0,Canonical mismatch; Orphaned
https://dolarexpress.cl/sacar-plata-tarjeta-polar/,"Sacar Plata Tarjeta Polar: Proceso, Costos y Riesg","Sacar Plata Tarjeta Polar: comisión 15%, proceso e",Sacar Plata Tarjeta Polar,https://dolarexpress.cl/avance-la-polar-cuotas/,20,0,Canonical mismatch; Orphaned
https://dolarexpress.cl/servicios-cupo-dolar/,Servicios de cambio de cupo en dólares | DolarExpr,Conoce los servicios de DolarExpress para cambiar ,Servicios de cambio de cupo en dólares,https://dolarexpress.cl/servicios-cupo-dolar.html,9,0,Canonical mismatch; Orphaned
https://dolarexpress.cl/superavance-cmr-falabella/,Alternativa al Superavance CMR: Comparativa de Cos,Comparativa: superavance vs cupo de compras CMR. C,Superavance Cmr Falabella,https://dolarexpress.cl/sacar-plata-cmr/,20,0,Canonical mismatch; Orphaned
https://dolarexpress.cl/superavance-tarjeta-lider/,Alternativa al Superavance Líder: Comparativa de C,Comparativa: superavance vs cupo de compras Líder.,Superavance Tarjeta Lider,https://dolarexpress.cl/avance-lider-bci-online/,20,0,Canonical mismatch; Orphaned
https://dolarexpress.cl/superavance-tarjeta-paris-cencosud/,Alternativa al Superavance Paris / Cencosud: Compa,Comparativa: superavance vs cupo de compras Paris ,Superavance Tarjeta Paris Cencosud,https://dolarexpress.cl/avance-tarjeta-easy/,20,0,Canonical mismatch; Orphaned
https://dolarexpress.cl/tarjeta-abc-din-efectivo-rapido/,Efectivo con ABCDin en 20 minutos: Proceso y Costo,Efectivo en 20 minutos con ABCDin. Comisión 15%. C,Tarjeta Abc Din Efectivo RáPido,https://dolarexpress.cl/avance-abc-visa/,20,0,Canonical mismatch; Orphaned
https://dolarexpress.cl/tarjeta-abc-sin-avance/,ABCDin Sin Avance: Cómo Obtener Efectivo con Cupo ,Obtén efectivo de tu ABCDin sin avance habilitado.,Tarjeta Abc Sin Avance,https://dolarexpress.cl/tarjeta-abc-sin-avance/,20,0,Orphaned
https://dolarexpress.cl/tarjeta-cmr-sin-avance/,CMR Sin Avance: Cómo Obtener Efectivo con Cupo de ,Obtén efectivo de tu CMR sin avance habilitado. Co,Tarjeta Cmr Sin Avance,https://dolarexpress.cl/tarjeta-cmr-sin-avance/,20,0,Orphaned
https://dolarexpress.cl/tarjeta-credito-cupo-dolar/,Tarjeta de Crédito con Cupo en Dólares Chile | Dol,Conoce qué tarjetas de crédito tienen cupo en dóla,¿Tu tarjeta tiene cupo en dólares? Aprovéchalo,https://dolarexpress.cl/tarjeta-credito-cupo-dolar.html,17,0,Canonical mismatch; Orphaned
https://dolarexpress.cl/tarjeta-hites-sin-avance/,Hites Sin Avance: Cómo Obtener Efectivo con Cupo d,Obtén efectivo de tu Hites sin avance habilitado. ,Tarjeta Hites Sin Avance,https://dolarexpress.cl/tarjeta-hites-sin-avance/,20,0,Orphaned
https://dolarexpress.cl/tarjeta-la-polar-sin-avance/,La Polar Sin Avance: Cómo Obtener Efectivo con Cup,Obtén efectivo de tu La Polar sin avance habilitad,Tarjeta La Polar Sin Avance,https://dolarexpress.cl/tarjeta-la-polar-sin-avance/,20,0,Orphaned
https://dolarexpress.cl/tarjeta-lider-bci-efectivo-rapido/,Efectivo con Líder en 20 minutos: Proceso y Costos,Efectivo en 20 minutos con Líder. Comisión 15%. Cr,Tarjeta Lider Bci Efectivo RáPido,https://dolarexpress.cl/avance-lider-bci-online/,20,0,Canonical mismatch; Orphaned
https://dolarexpress.cl/tarjeta-lider-con-cupo-y-sin-avance/,Líder Sin Avance: Cómo Obtener Efectivo con Cupo d,Obtén efectivo de tu Líder sin avance habilitado. ,Tarjeta Lider Con Cupo Y Sin Avance,https://dolarexpress.cl/tarjeta-lider-sin-avance/,20,0,Canonical mismatch; Orphaned
https://dolarexpress.cl/tarjeta-lider-sin-avance/,Líder Sin Avance: Cómo Obtener Efectivo con Cupo d,Obtén efectivo de tu Líder sin avance habilitado. ,Tarjeta Lider Sin Avance,https://dolarexpress.cl/tarjeta-lider-sin-avance/,20,0,Orphaned
https://dolarexpress.cl/tarjeta-paris-plata-rapido/,Efectivo con Paris / Cencosud en 25 minutos: Proce,Efectivo en 25 minutos con Paris / Cencosud. Comis,Tarjeta Paris Plata RáPido,https://dolarexpress.cl/avance-tarjeta-easy/,20,0,Canonical mismatch; Orphaned
https://dolarexpress.cl/tarjeta-paris-sin-avance/,Paris / Cencosud Sin Avance: Cómo Obtener Efectivo,Obtén efectivo de tu Paris / Cencosud sin avance h,Tarjeta Paris Sin Avance,https://dolarexpress.cl/tarjeta-paris-sin-avance/,20,0,Orphaned
https://dolarexpress.cl/tarjeta-retail-efectivo-mismo-dia/,Efectivo con tu tarjeta de tienda en 15-30 minutos,Efectivo en 15-30 minutos con tu tarjeta de tienda,Tarjeta Retail Efectivo Mismo DíA,https://dolarexpress.cl/sacar-plata-ripley/,20,0,Canonical mismatch; Orphaned
https://dolarexpress.cl/tarjeta-ripley-efectivo-inmediato/,Efectivo con Ripley en 20 minutos: Proceso y Costo,Efectivo en 20 minutos con Ripley. Comisión 15%. C,Tarjeta Ripley Efectivo Inmediato,https://dolarexpress.cl/sacar-plata-ripley/,20,0,Canonical mismatch; Orphaned
https://dolarexpress.cl/tarjeta-ripley-sin-avance/,Ripley Sin Avance: Cómo Obtener Efectivo con Cupo ,Obtén efectivo de tu Ripley sin avance habilitado.,Tarjeta Ripley Sin Avance,https://dolarexpress.cl/tarjeta-ripley-sin-avance/,20,0,Orphaned
https://dolarexpress.cl/tarjeta-sin-avance-habilitado-chile/,tu tarjeta de tienda Sin Avance: Cómo Obtener Efec,Obtén efectivo de tu tu tarjeta de tienda sin avan,Tarjeta Sin Avance Habilitado Chile,https://dolarexpress.cl/tarjeta-ripley-sin-avance/,20,0,Canonical mismatch; Orphaned
